id,type,x_gear_name,start_date_local,x_start_h,name,x_min,x_km,x_min/km,km/h,x_max_km/h,x_mi,x_min/mi,x_mph,x_max_mph,total_elevation_gain,x_elev_m/km,average_heartrate,max_heartrate,average_cadence,average_watts,kilojoules,commute,private,visibility,workout_type,x_nearest_city_start,x_start_locality,x_end_locality,x_dist_start_end_km,start_latlng,end_latlng,elev_low,elev_high,kudos_count,comment_count,achievement_count,athlete,athlete_count,average_speed,device_watts,display_hide_heartrate_option,distance,elapsed_time,external_id,flagged,from_accepted_tag,gear_id,has_heartrate,has_kudoed,heartrate_opt_out,location_city,location_country,location_state,manual,map,max_speed,moving_time,photo_count,pr_count,resource_state,start_date,start_latitude,start_longitude,timezone,total_photo_count,trainer,upload_id,upload_id_str,utc_offset,x_date,x_elev_%,x_url
975545643,Run,,11.02.2017 10:44:52,10.7,Morning Run,74.3,11.448,6.5,9.24,13.32,7.113,10.45,5.74,8.28,70.5,6.16,,,83.4,,,0,0,everyone,,EU-GB-ENG-Beeston,,,0,"[52.935756, -1.203424]","[52.935887, -1.203018]",26.9,66,0,0,2,{id},1,2.566,,0,11447.6,4792,garmin_push_1598534582,0,0,,0,0,0,,United Kingdom,,0,{id},3.7,4461,0,1,2,11.02.2017 10:44:52,52.935756,-1.203424,(GMT+00:00) Europe/London,0,0,1076615950,1076615950,0,2017-02-11,0.62,https://www.strava.com/activities/975545643
975545595,Run,,18.02.2017 10:15:44,10.3,Morning Run,82.8,12.755,6.49,9.24,13.32,7.925,10.45,5.74,8.28,87.1,6.83,,,82.5,,,0,0,everyone,,EU-GB-ENG-Beeston,,,0.2,"[52.935786, -1.203288]","[52.934055, -1.204216]",26.8,70.7,0,0,3,{id},1,2.567,,0,12754.8,5163,garmin_push_1598535080,0,0,,0,0,0,,United Kingdom,,0,{id},3.7,4968,0,0,2,18.02.2017 10:15:44,52.935786,-1.203288,(GMT+00:00) Europe/London,0,0,1076615949,1076615949,0,2017-02-18,0.68,https://www.strava.com/activities/975545595
975545491,Run,,19.02.2017 09:42:52,9.7,Morning Run,42.7,7.242,5.89,10.18,16.92,4.5,9.48,6.33,10.51,63.5,8.77,,,80.9,,,0,0,everyone,,EU-GB-ENG-Beeston,,,0.2,"[52.936119, -1.203178]","[52.934913, -1.201111]",24.8,64,0,0,2,{id},1,2.829,,0,7241.5,2622,garmin_push_1598535330,0,0,,0,0,0,,United Kingdom,,0,{id},4.7,2560,0,2,2,19.02.2017 09:42:52,52.936119,-1.203178,(GMT+00:00) Europe/London,0,0,1076615945,1076615945,0,2017-02-19,0.88,https://www.strava.com/activities/975545491
975545407,Run,,21.02.2017 06:00:58,6,Morning Run,37.1,6.446,5.75,10.43,12.96,4.005,9.26,6.48,8.05,61.3,9.51,,,81.3,,,0,0,everyone,,EU-GB-ENG-Beeston,,,0,"[52.93596, -1.203521]","[52.935819, -1.203331]",26.9,66.1,0,0,0,{id},1,2.898,,0,6445.8,2227,garmin_push_1598535617,0,0,,0,0,0,,United Kingdom,,0,{id},3.6,2224,0,0,2,21.02.2017 06:00:58,52.93596,-1.203521,(GMT+00:00) Europe/London,0,0,1076615940,1076615940,0,2017-02-21,0.95,https://www.strava.com/activities/975545407
975545534,Run,,22.02.2017 06:01:39,6,Morning Run,33.7,5.935,5.68,10.56,12.96,3.688,9.15,6.56,8.05,42.5,7.16,,,81.9,,,0,0,everyone,,EU-GB-ENG-Beeston,,,0,"[52.935708, -1.203256]","[52.935894, -1.203275]",26.9,66.9,0,0,1,{id},1,2.932,,0,5934.8,2024,garmin_push_1598535834,0,0,,0,0,0,,United Kingdom,,0,{id},3.6,2024,0,0,2,22.02.2017 06:01:39,52.935708,-1.203256,(GMT+00:00) Europe/London,0,0,1076615948,1076615948,0,2017-02-22,0.72,https://www.strava.com/activities/975545534
975545640,Run,,23.02.2017 05:57:01,6,Morning Run,38.2,6.444,5.93,10.12,12.96,4.004,9.54,6.29,8.05,62.9,9.76,,,81.2,,,0,0,everyone,,EU-GB-ENG-Beeston,,,0,"[52.936096, -1.203461]","[52.935786, -1.203392]",25.7,66,0,0,1,{id},1,2.812,,0,6444.2,2292,garmin_push_1598536040,0,0,,0,0,0,,United Kingdom,,0,{id},3.6,2292,0,0,2,23.02.2017 05:57:01,52.936096,-1.203461,(GMT+00:00) Europe/London,0,0,1076615944,1076615944,0,2017-02-23,0.98,https://www.strava.com/activities/975545640
975545515,Run,,25.02.2017 09:13:36,9.2,Morning Run,43.3,6.485,6.67,8.99,10.8,4.029,10.74,5.59,6.71,59.8,9.22,,,82,,,0,0,everyone,,EU-GB-ENG-Beeston,,,0,"[52.93598, -1.20312]","[52.935941, -1.203114]",33,75.4,0,0,3,{id},1,2.498,,0,6484.8,3138,garmin_push_1598536293,0,0,,0,0,0,,United Kingdom,,0,{id},3,2596,0,0,2,25.02.2017 09:13:36,52.93598,-1.20312,(GMT+00:00) Europe/London,0,0,1076615947,1076615947,0,2017-02-25,0.92,https://www.strava.com/activities/975545515
975545476,Run,,26.02.2017 11:03:54,11.1,Lunch Run,35.2,5.665,6.22,9.64,16.2,3.52,10.02,5.99,10.07,33.3,5.88,,,81,,,0,0,everyone,,EU-GB-ENG-Beeston,,,0,"[52.935821, -1.203292]","[52.935844, -1.203142]",24.7,46,0,0,0,{id},1,2.678,,0,5664.8,2161,garmin_push_1598536496,0,0,,0,0,0,,United Kingdom,,0,{id},4.5,2115,0,0,2,26.02.2017 11:03:54,52.935821,-1.203292,(GMT+00:00) Europe/London,0,0,1076615942,1076615942,0,2017-02-26,0.59,https://www.strava.com/activities/975545476
975545452,Run,,28.02.2017 06:02:56,6,Morning Run,35.1,6.441,5.45,11.01,14.76,4.003,8.77,6.84,9.17,62.7,9.73,,,82.7,,,0,0,everyone,,EU-GB-ENG-Beeston,,,0,"[52.935697, -1.203467]","[52.935465, -1.203041]",26.9,66,0,0,4,{id},1,3.059,,0,6441.5,2106,garmin_push_1598536686,0,0,,0,0,0,,United Kingdom,,0,{id},4.1,2106,0,0,2,28.02.2017 06:02:56,52.935697,-1.203467,(GMT+00:00) Europe/London,0,0,1076615943,1076615943,0,2017-02-28,0.97,https://www.strava.com/activities/975545452
975545593,Run,,01.03.2017 06:01:37,6,Morning Run,28.2,4.836,5.83,10.3,12.96,3.005,9.38,6.4,8.05,53.3,11.02,,,82.1,,,0,0,everyone,,EU-GB-ENG-Beeston,,,0,"[52.935878, -1.203272]","[52.935711, -1.203404]",28,63.7,0,0,3,{id},1,2.861,,0,4835.9,1690,garmin_push_1598536872,0,0,,0,0,0,,United Kingdom,,0,{id},3.6,1690,0,2,2,01.03.2017 06:01:37,52.935878,-1.203272,(GMT+00:00) Europe/London,0,0,1076615946,1076615946,0,2017-03-01,1.1,https://www.strava.com/activities/975545593
974615933,Run,,02.03.2017 06:02:44,6,Morning Run,37.1,6.445,5.76,10.42,14.76,4.005,9.27,6.47,9.17,61.1,9.48,,,82.5,,,0,0,everyone,,EU-GB-ENG-Beeston,,,0,"[52.935894, -1.203365]","[52.935662, -1.203385]",26.9,66.1,0,0,11,{id},1,2.894,,0,6445,2227,garmin_push_1719031416,0,0,,0,0,0,,United Kingdom,,0,{id},4.1,2227,0,0,2,02.03.2017 06:02:44,52.935894,-1.203365,(GMT+00:00) Europe/London,0,0,1075848848,1075848848,0,2017-03-02,0.95,https://www.strava.com/activities/974615933
974615849,Run,,04.03.2017 09:47:58,9.8,Morning Run,17.5,2.795,6.25,9.59,27.36,1.737,10.06,5.96,17,26.9,9.62,,,81.1,,,0,0,everyone,,EU-GB-ENG-Beeston,,,2.2,"[52.93465, -1.202537]","[52.950687, -1.182939]",28,60,0,0,4,{id},1,2.665,,0,2795.4,1049,garmin_push_1719031349,0,0,,0,0,0,,United Kingdom,,0,{id},7.6,1049,0,0,2,04.03.2017 09:47:58,52.93465,-1.202537,(GMT+00:00) Europe/London,0,0,1075848806,1075848806,0,2017-03-04,0.96,https://www.strava.com/activities/974615849
974615751,Run,,04.03.2017 10:47:51,10.8,Morning Run,22.8,3.415,6.67,8.99,11.16,2.122,10.74,5.59,6.93,23.5,6.88,,,81.9,,,0,0,everyone,,EU-GB-ENG-Nottingham,,,2.1,"[52.950781, -1.182947]","[52.935916, -1.203126]",24.7,42,0,0,5,{id},1,2.498,,0,3414.9,1415,garmin_push_1719031255,0,0,,0,0,0,,United Kingdom,,0,{id},3.1,1367,0,0,2,04.03.2017 10:47:51,52.950781,-1.182947,(GMT+00:00) Europe/London,0,0,1075848715,1075848715,0,2017-03-04,0.69,https://www.strava.com/activities/974615751
974615741,Run,,07.03.2017 06:03:02,6.1,Morning Run,36,6.444,5.58,10.75,14.76,4.004,8.98,6.68,9.17,61.5,9.54,,,82.3,,,0,0,everyone,,EU-GB-ENG-Beeston,,,0,"[52.935671, -1.2034]","[52.935728, -1.203434]",26.9,66,0,0,11,{id},1,2.986,,0,6444.1,2158,garmin_push_1719031230,0,0,,0,0,0,,United Kingdom,,0,{id},4.1,2158,0,0,2,07.03.2017 06:03:02,52.935671,-1.2034,(GMT+00:00) Europe/London,0,0,1075848686,1075848686,0,2017-03-07,0.95,https://www.strava.com/activities/974615741
974618138,Run,,08.03.2017 06:00:16,6,Morning Run,29.4,4.834,6.09,9.85,12.6,3.004,9.8,6.12,7.83,55.1,11.4,,,82.6,,,0,0,everyone,,EU-GB-ENG-Beeston,,,0,"[52.936087, -1.203255]","[52.935847, -1.202859]",27.9,64.1,0,0,3,{id},1,2.737,,0,4833.9,1766,garmin_push_1719033464,0,0,,0,0,0,,United Kingdom,,0,{id},3.5,1766,0,0,2,08.03.2017 06:00:16,52.936087,-1.203255,(GMT+00:00) Europe/London,0,0,1075850380,1075850380,0,2017-03-08,1.14,https://www.strava.com/activities/974618138
974618049,Run,,09.03.2017 06:00:51,6,Morning Run,35.4,6.446,5.5,10.92,20.88,4.005,8.84,6.78,12.97,65.2,10.11,,,83.1,,,0,0,everyone,,EU-GB-ENG-Beeston,,,0,"[52.935985, -1.203365]","[52.935896, -1.203318]",26.9,66,0,0,5,{id},1,3.033,,0,6446,2125,garmin_push_1719033324,0,0,,0,0,0,,United Kingdom,,0,{id},5.8,2125,0,2,2,09.03.2017 06:00:51,52.935985,-1.203365,(GMT+00:00) Europe/London,0,0,1075850266,1075850266,0,2017-03-09,1.01,https://www.strava.com/activities/974618049
974617983,Run,,12.03.2017 10:55:07,10.9,Morning Run,61.5,6.384,9.63,6.23,20.16,3.967,15.5,3.87,12.53,65.6,10.28,,,67,,,0,0,everyone,,EU-GB-ENG-Beeston,,,0.2,"[52.93583, -1.203227]","[52.934882, -1.201352]",24.7,41.4,0,0,3,{id},1,1.73,,0,6384.4,3692,garmin_push_1719033264,0,0,,0,0,0,,United Kingdom,,0,{id},5.6,3691,0,1,2,12.03.2017 10:55:07,52.93583,-1.203227,(GMT+00:00) Europe/London,0,0,1075850219,1075850219,0,2017-03-12,1.03,https://www.strava.com/activities/974617983
974617913,Run,,14.03.2017 05:59:42,6,Morning Run,36.2,6.445,5.62,10.67,14.4,4.005,9.05,6.63,8.95,65.2,10.12,,,82.4,,,0,0,everyone,,EU-GB-ENG-Beeston,,,0,"[52.936025, -1.203493]","[52.935925, -1.203076]",26.9,66.1,0,0,3,{id},1,2.963,,0,6445.1,2178,garmin_push_1719033201,0,0,,0,0,0,,United Kingdom,,0,{id},4,2175,0,0,2,14.03.2017 05:59:42,52.936025,-1.203493,(GMT+00:00) Europe/London,0,0,1075850170,1075850170,0,2017-03-14,1.01,https://www.strava.com/activities/974617913
974617887,Run,,15.03.2017 05:59:35,6,Morning Run,28.2,4.878,5.79,10.36,17.64,3.031,9.32,6.44,10.96,40.8,8.36,,,81.6,,,0,0,everyone,,EU-GB-ENG-Beeston,,,0,"[52.935749, -1.203111]","[52.935933, -1.203031]",26.9,66,0,0,2,{id},1,2.879,,0,4877.7,1694,garmin_push_1719033145,0,0,,0,0,0,,United Kingdom,,0,{id},4.9,1694,0,0,2,15.03.2017 05:59:35,52.935749,-1.203111,(GMT+00:00) Europe/London,0,0,1075850132,1075850132,0,2017-03-15,0.84,https://www.strava.com/activities/974617887
974617811,Run,,16.03.2017 06:04:54,6.1,Morning Run,28.1,5.122,5.48,10.94,20.88,3.183,8.82,6.8,12.97,57.6,11.25,,,82.2,,,0,0,everyone,,EU-GB-ENG-Beeston,,,0.7,"[52.935658, -1.19314]","[52.935963, -1.203042]",26.9,66.1,0,0,2,{id},1,3.04,,0,5122,1685,garmin_push_1719033104,0,0,,0,0,0,,United Kingdom,,0,{id},5.8,1685,0,0,2,16.03.2017 06:04:54,52.935658,-1.19314,(GMT+00:00) Europe/London,0,0,1075850092,1075850092,0,2017-03-16,1.12,https://www.strava.com/activities/974617811
974617814,Run,,18.03.2017 08:53:25,8.9,Morning Run,78.3,12.522,6.26,9.59,12.6,7.781,10.07,5.96,7.83,54.4,4.34,,,83.4,,,0,0,everyone,,EU-GB-ENG-Beeston,,,0,"[52.935745, -1.203353]","[52.935906, -1.203287]",27,67,0,0,3,{id},1,2.664,,0,12521.7,5381,garmin_push_1719033061,0,0,,0,0,0,,United Kingdom,,0,{id},3.5,4700,0,0,2,18.03.2017 08:53:25,52.935745,-1.203353,(GMT+00:00) Europe/London,0,0,1075850046,1075850046,0,2017-03-18,0.43,https://www.strava.com/activities/974617814
974617764,Run,,19.03.2017 09:54:44,9.9,Morning Run,75.1,13.344,5.63,10.66,23.04,8.292,9.06,6.63,14.32,139,10.42,,,82.6,,,0,0,everyone,,EU-GB-ENG-Beeston,,,0.6,"[52.93475, -1.202955]","[52.935715, -1.194031]",26,70.9,0,0,13,{id},1,2.962,,0,13344.3,4505,garmin_push_1719032984,0,0,,0,0,0,,United Kingdom,,0,{id},6.4,4505,0,7,2,19.03.2017 09:54:44,52.93475,-1.202955,(GMT+00:00) Europe/London,0,0,1075849993,1075849993,0,2017-03-19,1.04,https://www.strava.com/activities/974617764
974617721,Run,,21.03.2017 06:01:07,6,Morning Run,34.4,6.447,5.34,11.24,29.88,4.006,8.59,6.98,18.57,61.2,9.49,,,82,,,0,0,everyone,,EU-GB-ENG-Beeston,,,0,"[52.93561, -1.203479]","[52.935526, -1.203224]",26.9,66.1,0,0,9,{id},1,3.122,,0,6447.2,2065,garmin_push_1719032887,0,0,,0,0,0,,United Kingdom,,0,{id},8.3,2065,0,1,2,21.03.2017 06:01:07,52.93561,-1.203479,(GMT+00:00) Europe/London,0,0,1075849941,1075849941,0,2017-03-21,0.95,https://www.strava.com/activities/974617721
974617694,Run,,22.03.2017 06:00:05,6,Morning Run,30.8,5.407,5.7,10.52,13.68,3.36,9.18,6.54,8.5,39.9,7.38,,,82,,,0,0,everyone,,EU-GB-ENG-Beeston,,,0,"[52.936077, -1.203292]","[52.93583, -1.203009]",23.2,41.2,0,0,3,{id},1,2.923,,0,5407.3,1850,garmin_push_1719032826,0,0,,0,0,0,,United Kingdom,,0,{id},3.8,1850,0,0,2,22.03.2017 06:00:05,52.936077,-1.203292,(GMT+00:00) Europe/London,0,0,1075849908,1075849908,0,2017-03-22,0.74,https://www.strava.com/activities/974617694
974617617,Run,,23.03.2017 06:03:25,6.1,Morning Run,36.4,6.444,5.65,10.63,16.2,4.004,9.09,6.6,10.07,60.3,9.36,,,82.2,,,0,0,everyone,,EU-GB-ENG-Beeston,,,0,"[52.935841, -1.203359]","[52.935642, -1.203352]",26.9,66.1,0,0,3,{id},1,2.952,,0,6443.5,2183,garmin_push_1719032779,0,0,,0,0,0,,United Kingdom,,0,{id},4.5,2183,0,1,2,23.03.2017 06:03:25,52.935841,-1.203359,(GMT+00:00) Europe/London,0,0,1075849868,1075849868,0,2017-03-23,0.94,https://www.strava.com/activities/974617617
974617604,Run,,25.03.2017 09:55:55,9.9,Morning Run,60.8,9.998,6.08,9.86,12.6,6.212,9.79,6.13,7.83,63.9,6.39,,,83.3,,,0,0,everyone,,EU-GB-ENG-Beeston,,,0.1,"[52.935671, -1.203351]","[52.936151, -1.203777]",29.1,66.1,0,0,5,{id},1,2.74,,0,9997.7,3669,garmin_push_1719032725,0,0,,0,0,0,,United Kingdom,,0,{id},3.5,3649,0,2,2,25.03.2017 09:55:55,52.935671,-1.203351,(GMT+00:00) Europe/London,0,0,1075849809,1075849809,0,2017-03-25,0.64,https://www.strava.com/activities/974617604
974617541,Run,,28.03.2017 06:06:35,6.1,Morning Run,34.2,6.379,5.36,11.19,37.08,3.964,8.63,6.95,23.04,65.3,10.24,,,82.2,,,0,0,everyone,,EU-GB-ENG-Beeston,,,0.1,"[52.935248, -1.20214]","[52.935943, -1.203004]",26.9,66.1,0,0,3,{id},1,3.107,,0,6379,2053,garmin_push_1719032649,0,0,,0,0,0,,United Kingdom,,0,{id},10.3,2053,0,1,2,28.03.2017 05:06:35,52.935248,-1.20214,(GMT+00:00) Europe/London,0,0,1075849761,1075849761,3600,2017-03-28,1.02,https://www.strava.com/activities/974617541
974617518,Run,,29.03.2017 06:02:33,6,Morning Run,28.9,4.837,5.98,10.04,13.68,3.005,9.62,6.24,8.5,56.2,11.62,,,81.5,,,0,0,everyone,,EU-GB-ENG-Beeston,,,0,"[52.935964, -1.203356]","[52.935858, -1.202765]",28.1,64.1,0,0,3,{id},1,2.789,,0,4836.6,1734,garmin_push_1719032602,0,0,,0,0,0,,United Kingdom,,0,{id},3.8,1734,0,2,2,29.03.2017 05:02:33,52.935964,-1.203356,(GMT+00:00) Europe/London,0,0,1075849716,1075849716,3600,2017-03-29,1.16,https://www.strava.com/activities/974617518
974617462,Run,,30.03.2017 06:19:56,6.3,Morning Run,22.8,4.132,5.53,10.86,14.76,2.568,8.89,6.75,9.17,44.5,10.77,,,82.6,,,0,0,everyone,,EU-GB-ENG-Beeston,,,0.8,"[52.938675, -1.192312]","[52.93596, -1.203126]",33,66,0,0,2,{id},1,3.016,,0,4132.1,1370,garmin_push_1719032548,0,0,,0,0,0,,United Kingdom,,0,{id},4.1,1370,0,0,2,30.03.2017 05:19:56,52.938675,-1.192312,(GMT+00:00) Europe/London,0,0,1075849681,1075849681,3600,2017-03-30,1.08,https://www.strava.com/activities/974617462
974617443,Run,,01.04.2017 10:19:31,10.3,Morning Run,59.2,8.728,6.79,8.84,11.16,5.423,10.92,5.49,6.93,12.1,1.39,,,80.2,,,0,0,everyone,,EU-GB-ENG-Beeston,,,0,"[52.935564, -1.203509]","[52.935922, -1.203236]",25,38,0,0,1,{id},1,2.456,,0,8728.2,3972,garmin_push_1719032497,0,0,,0,0,0,,United Kingdom,,0,{id},3.1,3554,0,1,2,01.04.2017 09:19:31,52.935564,-1.203509,(GMT+00:00) Europe/London,0,0,1075849643,1075849643,3600,2017-04-01,0.14,https://www.strava.com/activities/974617443
974617331,Run,,01.04.2017 11:28:16,11.5,Lunch Run,7.1,1.27,5.59,10.74,13.32,0.789,8.99,6.67,8.28,0,,,,80.9,,,0,0,everyone,,EU-GB-ENG-Beeston,,,0,"[52.935679, -1.203361]","[52.935678, -1.203303]",30,38,0,0,0,{id},1,2.982,,0,1270.4,489,garmin_push_1719032378,0,0,,0,0,0,,United Kingdom,,0,{id},3.7,426,0,0,2,01.04.2017 10:28:16,52.935679,-1.203361,(GMT+00:00) Europe/London,0,0,1075849583,1075849583,3600,2017-04-01,,https://www.strava.com/activities/974617331
974617290,Run,,09.04.2017 11:53:44,11.9,Lunch Run,49.6,7.73,6.42,9.34,11.16,4.803,10.34,5.8,6.93,70.9,9.17,,,82.8,,,0,0,everyone,,EU-GB-ENG-Beeston,,,0,"[52.93572, -1.203275]","[52.935883, -1.203158]",33,70.9,0,0,4,{id},1,2.595,,0,7729.6,2982,garmin_push_1719032297,0,0,,0,0,0,,United Kingdom,,0,{id},3.1,2979,0,3,2,09.04.2017 10:53:44,52.93572,-1.203275,(GMT+00:00) Europe/London,0,0,1075849539,1075849539,3600,2017-04-09,0.92,https://www.strava.com/activities/974617290
974617212,Run,,11.04.2017 07:13:07,7.2,Morning Run,38.7,6.643,5.83,10.3,17.64,4.128,9.38,6.4,10.96,63.2,9.51,,,81.3,,,0,0,everyone,,EU-GB-ENG-Beeston,,,0.1,"[52.935669, -1.203608]","[52.936026, -1.20301]",28.2,60,0,0,1,{id},1,2.86,,0,6643.1,2798,garmin_push_1719032247,0,0,,0,0,0,,United Kingdom,,0,{id},4.9,2323,0,1,2,11.04.2017 06:13:07,52.935669,-1.203608,(GMT+00:00) Europe/London,0,0,1075849486,1075849486,3600,2017-04-11,0.95,https://www.strava.com/activities/974617212
974617182,Run,,12.04.2017 06:02:42,6,Morning Run,29.2,4.832,6.05,9.92,13.32,3.003,9.74,6.16,8.28,50.2,10.39,,,80.2,,,0,0,everyone,,EU-GB-ENG-Beeston,,,0,"[52.935733, -1.203375]","[52.93575, -1.203332]",26,66.1,0,0,1,{id},1,2.755,,0,4832.4,1754,garmin_push_1719032174,0,0,,0,0,0,,United Kingdom,,0,{id},3.7,1754,0,1,2,12.04.2017 05:02:42,52.935733,-1.203375,(GMT+00:00) Europe/London,0,0,1075849447,1075849447,3600,2017-04-12,1.04,https://www.strava.com/activities/974617182
974617163,Run,,13.04.2017 05:59:41,6,Morning Run,29.5,4.835,6.1,9.84,14.4,3.005,9.81,6.11,8.95,25.5,5.27,,,80.5,,,0,0,everyone,,EU-GB-ENG-Beeston,,,0,"[52.935701, -1.203407]","[52.935929, -1.203297]",24.7,48,0,0,0,{id},1,2.733,,0,4835.4,1810,garmin_push_1719032114,0,0,,0,0,0,,United Kingdom,,0,{id},4,1769,0,0,2,13.04.2017 04:59:41,52.935701,-1.203407,(GMT+00:00) Europe/London,0,0,1075849388,1075849388,3600,2017-04-13,0.53,https://www.strava.com/activities/974617163
974617047,Run,,17.04.2017 10:07:22,10.1,Easter 10K,51.4,9.831,5.22,11.49,20.52,6.109,8.41,7.14,12.75,143,14.55,,,84,,,0,0,everyone,0,EU-GB-ENG-Nottingham,,,0.1,"[52.950405, -1.210912]","[52.94999, -1.211501]",35.7,62.8,0,0,16,{id},49,3.191,,0,9830.9,3081,garmin_push_1719032058,0,0,,0,0,0,,United Kingdom,,0,{id},5.7,3081,0,6,2,17.04.2017 09:07:22,52.950405,-1.210912,(GMT+00:00) Europe/London,0,0,1075849349,1075849349,3600,2017-04-17,1.45,https://www.strava.com/activities/974617047
974617032,Run,,19.04.2017 09:05:19,9.1,Morning Run,29.6,4.377,6.76,8.87,10.44,2.72,10.89,5.51,6.49,0,,,,82.3,,,0,0,everyone,,EU-GB-ENG-Beeston,,,0.9,"[52.935086, -1.216352]","[52.928759, -1.208425]",26.1,43.3,0,0,0,{id},1,2.464,,0,4376.7,1844,garmin_push_1719031986,0,0,,0,0,0,,United Kingdom,,0,{id},2.9,1776,0,0,2,19.04.2017 08:05:19,52.935086,-1.216352,(GMT+00:00) Europe/London,0,0,1075849298,1075849298,3600,2017-04-19,,https://www.strava.com/activities/974617032
974616958,Run,,22.04.2017 10:40:39,10.7,Morning Run,51.6,8.049,6.42,9.35,12.96,5.001,10.33,5.81,8.05,54.3,6.75,,,80.5,,,0,0,everyone,,EU-GB-ENG-Beeston,,,0.1,"[52.935869, -1.203389]","[52.935424, -1.203001]",32.5,61.7,0,0,1,{id},1,2.597,,0,8049,3157,garmin_push_1719031913,0,0,,0,0,0,,United Kingdom,,0,{id},3.6,3099,0,0,2,22.04.2017 09:40:39,52.935869,-1.203389,(GMT+00:00) Europe/London,0,0,1075849260,1075849260,3600,2017-04-22,0.67,https://www.strava.com/activities/974616958
974616872,Run,,24.04.2017 06:00:54,6,Morning Run,27.8,4.839,5.75,10.44,15.12,3.007,9.25,6.49,9.4,61.5,12.71,,,81.1,,,0,0,everyone,,EU-GB-ENG-Beeston,,,0.2,"[52.935778, -1.203602]","[52.936821, -1.205507]",32.7,66.1,0,0,0,{id},1,2.901,,0,4838.7,1668,garmin_push_1719031869,0,0,,0,0,0,,United Kingdom,,0,{id},4.2,1668,0,0,2,24.04.2017 05:00:54,52.935778,-1.203602,(GMT+00:00) Europe/London,0,0,1075849212,1075849212,3600,2017-04-24,1.27,https://www.strava.com/activities/974616872
974616577,Run,,25.04.2017 06:02:57,6,Morning Run,36.2,6.512,5.56,10.79,14.04,4.046,8.95,6.71,8.72,61.2,9.4,,,82.4,,,0,0,everyone,,EU-GB-ENG-Beeston,,,0,"[52.935688, -1.203574]","[52.936073, -1.203467]",26.9,66,0,0,7,{id},1,2.998,,0,6511.9,2172,garmin_push_1719031791,0,0,,0,0,0,,United Kingdom,,0,{id},3.9,2172,0,0,2,25.04.2017 05:02:57,52.935688,-1.203574,(GMT+00:00) Europe/London,0,0,1075849136,1075849136,3600,2017-04-25,0.94,https://www.strava.com/activities/974616577
974616480,Run,,26.04.2017 06:01:41,6,"40 min Tempo (10, 20, 10)",40,7.154,5.6,10.72,15.12,4.445,9.01,6.66,9.4,51.9,7.25,,,82.4,,,0,0,everyone,0,EU-GB-ENG-Beeston,,,0.1,"[52.93573, -1.203511]","[52.936171, -1.203661]",24.7,40.8,0,0,14,{id},1,2.978,,0,7154.1,2402,garmin_push_1719031639,0,0,,0,0,0,,United Kingdom,,0,{id},4.2,2402,0,3,2,26.04.2017 05:01:41,52.93573,-1.203511,(GMT+00:00) Europe/London,0,0,1075849099,1075849099,3600,2017-04-26,0.73,https://www.strava.com/activities/974616480
974616191,Run,,27.04.2017 06:16:23,6.3,Morning Run,28.3,4.833,5.85,10.26,15.84,3.003,9.41,6.38,9.84,21.4,4.43,,,82.4,,,0,0,everyone,,EU-GB-ENG-Beeston,,,0,"[52.935689, -1.203343]","[52.935636, -1.203406]",33,56.9,0,0,0,{id},1,2.85,,0,4833.1,1701,garmin_push_1719031582,0,0,,0,0,0,,United Kingdom,,0,{id},4.4,1696,0,0,2,27.04.2017 05:16:23,52.935689,-1.203343,(GMT+00:00) Europe/London,0,0,1075848988,1075848988,3600,2017-04-27,0.44,https://www.strava.com/activities/974616191
974616076,Run,,04.05.2017 06:03:16,6.1,Morning Run,37.3,6.446,5.79,10.36,15.48,4.005,9.32,6.44,9.62,62.7,9.73,,,81.4,,,0,0,everyone,,EU-GB-ENG-Beeston,,,0,"[52.935662, -1.203407]","[52.935527, -1.203179]",26.9,66.1,0,0,1,{id},1,2.879,,0,6445.8,2239,garmin_push_1719031503,0,0,,0,0,0,,United Kingdom,,0,{id},4.3,2239,0,0,2,04.05.2017 05:03:16,52.935662,-1.203407,(GMT+00:00) Europe/London,0,0,1075848914,1075848914,3600,2017-05-04,0.97,https://www.strava.com/activities/974616076
974556028,Run,,07.05.2017 07:30:03,7.5,Pretend 5K Race,24.8,5.017,4.94,12.15,16.56,3.117,7.95,7.55,10.29,60.8,12.12,,,85.5,,,0,0,everyone,0,EU-GB-ENG-Beeston,,,0.9,"[52.936056, -1.203176]","[52.938839, -1.215884]",26.9,66,1,0,5,{id},1,3.376,,0,5016.8,1486,garmin_push_1719031454,0,0,,0,0,0,,United Kingdom,,0,{id},4.6,1486,0,2,2,07.05.2017 06:30:03,52.936056,-1.203176,(GMT+00:00) Europe/London,0,0,1075848884,1075848884,3600,2017-05-07,1.21,https://www.strava.com/activities/974556028
977216449,Run,,08.05.2017 15:36:09,15.6,Afternoon Run,37,6.452,5.74,10.45,17.64,4.009,9.24,6.49,10.96,42.7,6.62,,,81.4,,,0,0,everyone,,EU-GB-ENG-Beeston,,,0.4,"[52.937016, -1.198685]","[52.934438, -1.203411]",26,60,1,0,2,{id},1,2.902,,0,6452.1,2300,garmin_push_1722487196,0,0,,0,0,0,,United Kingdom,,0,{id},4.9,2223,0,1,2,08.05.2017 14:36:09,52.937016,-1.198685,(GMT+00:00) Europe/London,0,0,1078634737,1078634737,3600,2017-05-08,0.66,https://www.strava.com/activities/977216449
979585574,Run,,09.05.2017 06:02:48,6,Morning Run,48.8,8.055,6.05,9.91,12.6,5.005,9.74,6.16,7.83,80.2,9.96,,,82,,,0,0,everyone,,EU-GB-ENG-Beeston,,,0,"[52.935662, -1.203428]","[52.936018, -1.203423]",33,75.8,0,0,3,{id},1,2.754,,0,8055.1,2967,garmin_push_1725305478,0,0,,0,0,0,,United Kingdom,,0,{id},3.5,2925,0,0,2,09.05.2017 05:02:48,52.935662,-1.203428,(GMT+00:00) Europe/London,0,0,1081214396,1081214396,3600,2017-05-09,1,https://www.strava.com/activities/979585574
979585903,Run,,10.05.2017 06:03:32,6.1,"45 min Tempo (10, 22, 13)",45.7,8.055,5.68,10.57,15.48,5.005,9.14,6.57,9.62,41.2,5.11,,,82,,,0,0,everyone,0,EU-GB-ENG-Beeston,,,0,"[52.935853, -1.203593]","[52.93553, -1.203188]",24.7,41.5,2,0,3,{id},1,2.936,,0,8055.2,2744,garmin_push_1725305797,0,0,,0,0,0,,United Kingdom,,0,{id},4.3,2744,0,1,2,10.05.2017 05:03:32,52.935853,-1.203593,(GMT+00:00) Europe/London,0,0,1081214680,1081214680,3600,2017-05-10,0.51,https://www.strava.com/activities/979585903
980827807,Run,,11.05.2017 05:59:08,6,Morning Run,26.9,4.837,5.56,10.79,12.96,3.006,8.95,6.7,8.05,24.5,5.07,,,81.6,,,0,0,everyone,,EU-GB-ENG-Beeston,,,0,"[52.9357, -1.203867]","[52.935827, -1.203423]",31.9,57.3,1,0,2,{id},1,2.997,,0,4837.1,1614,garmin_push_1726786414,0,0,,0,0,0,,United Kingdom,,0,{id},3.6,1614,0,1,2,11.05.2017 04:59:08,52.9357,-1.203867,(GMT+00:00) Europe/London,0,0,1082644814,1082644814,3600,2017-05-11,0.51,https://www.strava.com/activities/980827807
983945189,Ride,,13.05.2017 11:17:55,11.3,60 min cross train--Lunch Ride,59.5,17.847,3.33,18,34.2,11.089,5.37,11.18,21.25,88.6,4.96,,,,,,0,0,everyone,10,EU-GB-ENG-Beeston,,,0,"[52.935666, -1.203265]","[52.935775, -1.203147]",26.8,80.9,1,0,3,{id},1,4.999,0,0,17846.6,3664,03c7215ea2ef40fae9bb8b1a5be6118e,0,0,,0,0,0,,United Kingdom,,0,{id},9.5,3570,0,2,2,13.05.2017 10:17:55,52.935666,-1.203265,(GMT+00:00) Europe/London,0,0,1086382477,1086382477,3600,2017-05-13,0.5,https://www.strava.com/activities/983945189
985609369,Run,,14.05.2017 10:46:03,10.8,Morning Run,53.1,9.66,5.49,10.92,13.68,6.003,8.84,6.79,8.5,50.4,5.22,,,82.6,,,0,0,everyone,,EU-GB-ENG-Beeston,,,0.6,"[52.935712, -1.203233]","[52.935434, -1.194537]",26,76.1,1,0,4,{id},1,3.034,,0,9660.1,3184,garmin_push_1732562908,0,0,,0,0,0,,United Kingdom,,0,{id},3.8,3184,0,4,2,14.05.2017 09:46:03,52.935712,-1.203233,(GMT+00:00) Europe/London,0,0,1088333980,1088333980,3600,2017-05-14,0.52,https://www.strava.com/activities/985609369
986941282,Run,,15.05.2017 06:03:28,6.1,Morning Run,27,4.831,5.6,10.72,14.4,3.002,9.01,6.66,8.95,51.9,10.74,,,82.4,,,0,0,everyone,,EU-GB-ENG-Beeston,,,0,"[52.935662, -1.203438]","[52.935533, -1.202852]",32.5,66.1,2,0,1,{id},1,2.978,,0,4830.8,1622,garmin_push_1734337677,0,0,,0,0,0,,United Kingdom,,0,{id},4,1622,0,0,2,15.05.2017 05:03:28,52.935662,-1.203438,(GMT+00:00) Europe/London,0,0,1089940141,1089940141,3600,2017-05-15,1.07,https://www.strava.com/activities/986941282
988685975,Run,,16.05.2017 05:59:18,6,Morning Run,51.2,8.85,5.79,10.36,13.32,5.499,9.32,6.44,8.28,66.2,7.48,,,82.7,,,0,0,everyone,,EU-GB-ENG-Beeston,,,0,"[52.935661, -1.20331]","[52.935566, -1.203378]",29.1,61.5,2,0,7,{id},1,2.878,,0,8850,3075,garmin_push_1736162886,0,0,,0,0,0,,United Kingdom,,0,{id},3.7,3075,0,2,2,16.05.2017 04:59:18,52.935661,-1.20331,(GMT+00:00) Europe/London,0,0,1091679884,1091679884,3600,2017-05-16,0.75,https://www.strava.com/activities/988685975
991403846,Run,,17.05.2017 06:00:40,6,10 x 400s with warm-up and cool down,39.7,6.846,5.8,10.35,16.56,4.254,9.33,6.43,10.29,0,,,,78.9,,,0,0,everyone,0,EU-GB-ENG-Beeston,,,0,"[52.935813, -1.203274]","[52.935849, -1.203095]",29.3,38,2,0,1,{id},1,2.875,,0,6846,2418,garmin_push_1738119115,0,0,,0,0,0,,United Kingdom,,0,{id},4.6,2381,0,1,2,17.05.2017 05:00:40,52.935813,-1.203274,(GMT+00:00) Europe/London,0,0,1093700780,1093700780,3600,2017-05-17,,https://www.strava.com/activities/991403846
993663677,Run,,18.05.2017 05:59:29,6,Morning Run,37.1,6.448,5.76,10.43,20.88,4.007,9.26,6.48,12.97,62.8,9.74,,,81.7,,,0,0,everyone,,EU-GB-ENG-Beeston,,,0,"[52.93564, -1.203462]","[52.935454, -1.202991]",26.9,66.1,2,0,1,{id},1,2.896,,0,6448.3,2227,garmin_push_1740001203,0,0,,0,0,0,,United Kingdom,,0,{id},5.8,2227,0,0,2,18.05.2017 04:59:29,52.93564,-1.203462,(GMT+00:00) Europe/London,0,0,1095742448,1095742448,3600,2017-05-18,0.97,https://www.strava.com/activities/993663677
996690692,Ride,,20.05.2017 11:19:03,11.3,"""60 minutes"" cross train and oh so lost",73.6,20.113,3.66,16.39,29.88,12.498,5.89,10.19,18.57,27.4,1.36,,,,,,0,0,everyone,10,EU-GB-ENG-Beeston,,,0,"[52.9357, -1.203276]","[52.93579, -1.203268]",22.9,40,1,0,2,{id},1,4.554,0,0,20113.5,4667,daa4ef0c3faff1aced6d8a46beb6622c,0,0,,0,0,0,,United Kingdom,,0,{id},8.3,4417,0,1,2,20.05.2017 10:19:03,52.9357,-1.203276,(GMT+00:00) Europe/London,1,0,1098827458,1098827458,3600,2017-05-20,0.14,https://www.strava.com/activities/996690692
998219005,Run,,21.05.2017 09:33:39,9.6,Morning Run,62.1,11.284,5.51,10.89,15.12,7.012,8.86,6.77,9.4,72.1,6.39,,,83.2,,,0,0,everyone,,EU-GB-ENG-Beeston,,,0.1,"[52.935733, -1.20335]","[52.934661, -1.203167]",26.9,61.6,2,0,9,{id},1,3.026,,0,11284.2,3729,garmin_push_1745734983,0,0,,0,0,0,,United Kingdom,,0,{id},4.2,3729,0,5,2,21.05.2017 08:33:39,52.935733,-1.20335,(GMT+00:00) Europe/London,0,0,1100395390,1100395390,3600,2017-05-21,0.64,https://www.strava.com/activities/998219005
999812289,Run,,22.05.2017 06:03:54,6.1,Morning Run,25.6,4.837,5.3,11.33,15.48,3.006,8.52,7.04,9.62,54,11.16,,,83.8,,,0,0,everyone,,EU-GB-ENG-Beeston,,,0,"[52.935603, -1.203372]","[52.93573, -1.203467]",33,66,2,0,6,{id},1,3.147,,0,4837.4,1537,garmin_push_1747834642,0,0,,0,0,0,,United Kingdom,,0,{id},4.3,1537,0,2,2,22.05.2017 05:03:54,52.935603,-1.203372,(GMT+00:00) Europe/London,0,0,1102044604,1102044604,3600,2017-05-22,1.12,https://www.strava.com/activities/999812289
1001301315,Run,,23.05.2017 06:01:31,6,Morning Run,55.2,9.885,5.58,10.75,15.12,6.142,8.99,6.68,9.4,75.4,7.63,,,83.2,,,0,0,everyone,,EU-GB-ENG-Beeston,,,0,"[52.935642, -1.203176]","[52.935996, -1.203416]",29.1,66.1,1,0,7,{id},1,2.985,,0,9885.2,3312,garmin_push_1749719872,0,0,,0,0,0,,United Kingdom,,0,{id},4.2,3312,0,4,2,23.05.2017 05:01:31,52.935642,-1.203176,(GMT+00:00) Europe/London,0,0,1103570193,1103570193,3600,2017-05-23,0.76,https://www.strava.com/activities/1001301315
1001549472,Ride,,23.05.2017 11:27:19,11.5,Lunch Ride,17.1,4.597,3.72,16.13,24.12,2.856,5.99,10.02,14.99,0,,,,,,,0,0,everyone,10,EU-GB-ENG-Beeston,,,3.4,"[52.926802, -1.215612]","[52.950548, -1.182817]",25.8,36,1,0,3,{id},1,4.48,0,0,4596.8,1076,2a1acd22bd42ffeea4630b020b591bd7,0,0,,0,0,0,,United Kingdom,,0,{id},6.7,1026,0,0,2,23.05.2017 10:27:19,52.926802,-1.215612,(GMT+00:00) Europe/London,0,0,1103824612,1103824612,3600,2017-05-23,,https://www.strava.com/activities/1001549472
1002932098,Run,,24.05.2017 05:59:46,6,"50-min tempo (10, 27.7, 12.5, home)",51.4,9.239,5.56,10.8,15.84,5.741,8.94,6.71,9.84,39.3,4.25,,,82.8,,,0,0,everyone,0,EU-GB-ENG-Beeston,,,0,"[52.935589, -1.203323]","[52.935831, -1.202964]",24.7,41.4,2,0,7,{id},1,2.999,,0,9238.8,3081,garmin_push_1755384312,0,0,,0,0,0,,United Kingdom,,0,{id},4.4,3081,0,4,2,24.05.2017 04:59:46,52.935589,-1.203323,(GMT+00:00) Europe/London,0,0,1105244896,1105244896,3600,2017-05-24,0.43,https://www.strava.com/activities/1002932098
1004433027,Run,,25.05.2017 05:59:50,6,Morning Run,37.7,6.444,5.85,10.26,12.6,4.004,9.41,6.38,7.83,60.5,9.39,,,82.2,,,0,0,everyone,,EU-GB-ENG-Beeston,,,0,"[52.935666, -1.203395]","[52.935985, -1.203384]",26.9,66,2,0,2,{id},1,2.851,,0,6443.9,2260,garmin_push_1757182383,0,0,,0,0,0,,United Kingdom,,0,{id},3.5,2260,0,0,2,25.05.2017 04:59:50,52.935666,-1.203395,(GMT+00:00) Europe/London,0,0,1106782299,1106782299,3600,2017-05-25,0.94,https://www.strava.com/activities/1004433027
1011322969,Run,,29.05.2017 14:25:33,14.4,Running the Royal Mile...then jogging/hiking,50.3,6.867,7.33,8.19,41.76,4.267,11.8,5.09,25.95,309.5,45.07,,,75.4,,,0,0,everyone,0,EU-GB-SCT-Edinburgh,,,0,"[55.950339, -3.187418]","[55.95027, -3.186776]",36.2,224,3,0,3,{id},1,2.274,,0,6866.7,4361,garmin_push_1766052066,0,0,,0,0,0,,United Kingdom,,0,{id},11.6,3020,0,3,2,29.05.2017 13:25:33,55.950339,-3.187418,(GMT+00:00) Europe/London,8,0,1113890734,1113890734,3600,2017-05-29,4.51,https://www.strava.com/activities/1011322969
1020495621,Run,,04.06.2017 09:30:43,9.5,"The Race for Life ""10K""",48.5,9.239,5.25,11.43,15.12,5.741,8.45,7.1,9.4,45.4,4.91,,,84.6,,,0,0,everyone,0,EU-GB-ENG-Nottingham,,,0,"[52.935227, -1.143628]","[52.935128, -1.143178]",20.5,33,1,0,1,{id},3,3.176,,0,9239.2,2909,garmin_push_1777303959,0,0,,0,0,0,,United Kingdom,,0,{id},4.2,2909,0,0,2,04.06.2017 08:30:43,52.935227,-1.143628,(GMT+00:00) Europe/London,1,0,1123324963,1123324963,3600,2017-06-04,0.49,https://www.strava.com/activities/1020495621
1029683717,Run,,10.06.2017 09:59:41,10,"Wollaton Park 10K ""Race""",55.6,10.015,5.55,10.81,15.12,6.223,8.93,6.72,9.4,165.3,16.51,,,83.7,,,0,0,everyone,1,EU-GB-ENG-Nottingham,,,0,"[52.952341, -1.201518]","[52.952304, -1.201451]",35.7,68.1,2,0,13,{id},27,3.004,,0,10014.9,3334,garmin_push_1788721230,0,0,,0,0,0,,United Kingdom,,0,{id},4.2,3334,0,5,2,10.06.2017 08:59:41,52.952341,-1.201518,(GMT+00:00) Europe/London,4,0,1132664998,1132664998,3600,2017-06-10,1.65,https://www.strava.com/activities/1029683717
1031123456,Ride,,11.06.2017 10:11:38,10.2,Morning Ride,73.7,19.765,3.73,16.08,39.24,12.281,6,9.99,24.38,159.7,8.08,,,,,,0,0,everyone,10,EU-GB-ENG-Beeston,,,0,"[52.93572, -1.203216]","[52.935753, -1.203272]",26.8,92.7,0,0,23,{id},1,4.468,0,0,19765,4473,3a0c220f1aefc35a1295c7957acd8877,0,0,,0,0,0,,United Kingdom,,0,{id},10.9,4424,0,2,2,11.06.2017 09:11:38,52.93572,-1.203216,(GMT+00:00) Europe/London,0,0,1134129609,1134129609,3600,2017-06-11,0.81,https://www.strava.com/activities/1031123456
1042143097,Run,,18.06.2017 09:54:45,9.9,Morning Run,36.6,6.444,5.68,10.56,14.4,4.004,9.15,6.56,8.95,88.7,13.76,,,81.1,,,0,0,everyone,,EU-GB-ENG-Beeston,,,0.1,"[52.93577, -1.203297]","[52.936334, -1.20411]",26.9,66.1,1,0,1,{id},1,2.932,,0,6443.8,2198,garmin_push_1804121356,0,0,,0,0,0,,United Kingdom,,0,{id},4,2198,0,0,2,18.06.2017 08:54:45,52.93577,-1.203297,(GMT+00:00) Europe/London,0,0,1145458641,1145458641,3600,2017-06-18,1.38,https://www.strava.com/activities/1042143097
1042935251,Ride,,18.06.2017 16:40:09,16.7,Afternoon Ride,38.4,10.46,3.67,16.36,44.28,6.499,5.9,10.16,27.51,105.5,10.09,,,,,,0,0,everyone,10,EU-GB-ENG-Beeston,,,0,"[52.935823, -1.202912]","[52.935651, -1.203267]",27,66,1,0,6,{id},1,4.544,0,0,10459.5,2386,6a7ce54a81ea068eee6dcde7852a1f63,0,0,,0,0,0,,United Kingdom,,0,{id},12.3,2302,0,1,2,18.06.2017 15:40:09,52.935823,-1.202912,(GMT+00:00) Europe/London,0,0,1146276477,1146276477,3600,2017-06-18,1.01,https://www.strava.com/activities/1042935251
1045457878,Run,,20.06.2017 11:33:08,11.6,Mile PR attempt #1-7:15,18.2,3.604,5.05,11.88,16.92,2.24,8.13,7.38,10.51,39.4,10.93,,,81.1,,,0,0,everyone,0,EU-GB-ENG-Beeston,,,0.4,"[52.935817, -1.203181]","[52.932764, -1.200407]",26.9,66,3,3,9,{id},1,3.301,,0,3604.3,1092,garmin_push_1808294036,0,0,,0,0,0,,United Kingdom,,0,{id},4.7,1092,0,3,2,20.06.2017 10:33:08,52.935817,-1.203181,(GMT+00:00) Europe/London,0,0,1148876482,1148876482,3600,2017-06-20,1.09,https://www.strava.com/activities/1045457878
1046823287,Run,,21.06.2017 06:17:01,6.3,Morning Run,37.6,6.448,5.84,10.28,16.56,4.007,9.39,6.39,10.29,91.5,14.19,,,81,,,0,0,everyone,,EU-GB-ENG-Beeston,,,0.1,"[52.935582, -1.202775]","[52.935761, -1.203483]",26.9,66.1,2,0,0,{id},1,2.856,,0,6448.1,2258,garmin_push_1809910935,0,0,,0,0,0,,United Kingdom,,0,{id},4.6,2258,0,0,2,21.06.2017 05:17:01,52.935582,-1.202775,(GMT+00:00) Europe/London,0,0,1150271658,1150271658,3600,2017-06-21,1.42,https://www.strava.com/activities/1046823287
1053077196,Run,,25.06.2017 10:29:07,10.5,Morning Run,82.2,13.682,6,9.99,15.84,8.501,9.66,6.21,9.84,149,10.89,,,81.6,,,0,0,everyone,,EU-GB-ENG-Beeston,,,0,"[52.935613, -1.203419]","[52.935984, -1.203343]",29.1,76,3,0,2,{id},1,2.776,,0,13681.6,5091,garmin_push_1817598491,0,0,,0,0,0,,United Kingdom,,0,{id},4.4,4929,0,0,2,25.06.2017 09:29:07,52.935613,-1.203419,(GMT+00:00) Europe/London,0,0,1156692301,1156692301,3600,2017-06-25,1.09,https://www.strava.com/activities/1053077196
1054540363,Run,,26.06.2017 06:13:58,6.2,Mile PR Attempt #2-7:13,23.6,4.252,5.56,10.79,15.12,2.642,8.95,6.71,9.4,61.8,14.53,,,81.1,,,0,0,everyone,0,EU-GB-ENG-Beeston,,,0.2,"[52.935718, -1.203339]","[52.936826, -1.206398]",32.5,66.1,2,0,5,{id},1,2.998,,0,4251.5,1418,garmin_push_1819414047,0,0,,0,0,0,,United Kingdom,,0,{id},4.2,1418,0,2,2,26.06.2017 05:13:58,52.935718,-1.203339,(GMT+00:00) Europe/London,0,0,1158200406,1158200406,3600,2017-06-26,1.45,https://www.strava.com/activities/1054540363
1056063839,Run,,27.06.2017 06:12:10,6.2,Morning Run,30.1,4.899,6.14,9.77,12.24,3.044,9.88,6.07,7.61,46.7,9.53,,,80.5,,,0,0,everyone,,EU-GB-ENG-Beeston,,,0.1,"[52.935721, -1.20323]","[52.935522, -1.202373]",24.7,40.9,2,0,0,{id},1,2.714,,0,4899.3,2419,garmin_push_1821285932,0,0,,0,0,0,,United Kingdom,,0,{id},3.4,1805,0,0,2,27.06.2017 05:12:10,52.935721,-1.20323,(GMT+00:00) Europe/London,0,0,1159754728,1159754728,3600,2017-06-27,0.95,https://www.strava.com/activities/1056063839
1057650623,Run,,28.06.2017 06:12:31,6.2,Mile PR Attempt #3- 7:00,24.9,4.508,5.53,10.86,16.2,2.801,8.89,6.75,10.07,61.4,13.62,,,80.3,,,0,0,everyone,0,EU-GB-ENG-Beeston,,,0,"[52.935771, -1.203195]","[52.93608, -1.203509]",32.5,66,3,4,6,{id},1,3.016,,0,4508.3,1561,garmin_push_1823190019,0,0,,0,0,0,,United Kingdom,,0,{id},4.5,1495,0,1,2,28.06.2017 05:12:31,52.935771,-1.203195,(GMT+00:00) Europe/London,0,0,1161367841,1161367841,3600,2017-06-28,1.36,https://www.strava.com/activities/1057650623
1059097772,Run,,29.06.2017 06:11:00,6.2,"Mile PR Attempt#4- 6:59, but I still think I can do better. The quest continues stateside!",25,4.479,5.58,10.75,17.28,2.783,8.98,6.68,10.74,62.6,13.98,,,79.9,,,0,0,everyone,0,EU-GB-ENG-Beeston,,,0,"[52.936004, -1.203117]","[52.93595, -1.203368]",32.3,66.1,3,0,5,{id},1,2.986,,0,4479.1,1573,garmin_push_1824988167,0,0,,0,0,0,,United Kingdom,,0,{id},4.8,1500,0,1,2,29.06.2017 05:11:00,52.936004,-1.203117,(GMT+00:00) Europe/London,0,0,1162824176,1162824176,3600,2017-06-29,1.4,https://www.strava.com/activities/1059097772
1063816532,Run,,02.07.2017 07:17:41,7.3,3 miles with Molly,34,5.274,6.44,9.32,41.4,3.277,10.36,5.79,25.72,62.1,11.77,,,77.8,,,0,0,everyone,0,NA-US-KY-Berea,,,0.4,"[37.572793, -84.277806]","[37.573274, -84.282058]",281.5,314.1,2,0,0,{id},1,2.588,,0,5274,2592,garmin_push_1830704000,0,0,,0,0,0,,United Kingdom,,0,{id},11.5,2038,0,0,2,02.07.2017 11:17:41,37.572793,-84.277806,(GMT-05:00) America/New_York,0,0,1167614587,1167614587,-14400,2017-07-02,1.18,https://www.strava.com/activities/1063816532
1065437283,Run,,03.07.2017 07:20:30,7.3,Morning Run with Molly,34.2,4.84,7.06,8.5,12.96,3.008,11.36,5.28,8.05,36.1,7.46,,,80.4,,,0,0,everyone,0,NA-US-KY-Berea,,,0.2,"[37.573419, -84.28132]","[37.573416, -84.283053]",292,314.1,1,0,0,{id},1,2.361,,0,4840.2,2098,garmin_push_1832695578,0,0,,0,0,0,,United Kingdom,,0,{id},3.6,2050,0,0,2,03.07.2017 11:20:30,37.573419,-84.28132,(GMT-05:00) America/New_York,0,0,1169261398,1169261398,-14400,2017-07-03,0.75,https://www.strava.com/activities/1065437283
1066965385,Run,,04.07.2017 07:13:59,7.2,"Morning Run with Molly (poor baby, I had to drag her the entire way)",32.1,4.832,6.65,9.02,15.12,3.002,10.7,5.61,9.4,35.7,7.39,,,80.9,,,0,0,everyone,0,NA-US-KY-Berea,,,0.1,"[37.573412, -84.281596]","[37.573327, -84.283086]",292,314.1,3,0,0,{id},1,2.506,,0,4831.9,2035,garmin_push_1834544406,0,0,,0,0,0,,United Kingdom,,0,{id},4.2,1928,0,0,2,04.07.2017 11:13:59,37.573412,-84.281596,(GMT-05:00) America/New_York,1,0,1170806310,1170806310,-14400,2017-07-04,0.74,https://www.strava.com/activities/1066965385
1068642501,Run,,05.07.2017 07:01:07,7,Morning Run with Molly,33.3,4.882,6.82,8.8,12.24,3.034,10.97,5.47,7.61,36.1,7.39,,,80.5,,,0,0,everyone,0,NA-US-KY-Berea,,,0.1,"[37.573476, -84.281413]","[37.573229, -84.283062]",292,314.1,2,0,0,{id},1,2.444,,0,4882.2,2093,garmin_push_1836505122,0,0,,0,0,0,,United Kingdom,,0,{id},3.4,1998,0,0,2,05.07.2017 11:01:07,37.573476,-84.281413,(GMT-05:00) America/New_York,0,0,1172503839,1172503839,-14400,2017-07-05,0.74,https://www.strava.com/activities/1068642501
1072334481,Run,,07.07.2017 07:17:03,7.3,Molly has finished a week of my Couch-2-5K program,31.3,4.877,6.41,9.36,14.04,3.03,10.32,5.81,8.72,35.9,7.36,,,80.9,,,0,0,everyone,0,NA-US-KY-Berea,,,0.1,"[37.573315, -84.281399]","[37.573149, -84.282998]",292,314.1,0,0,0,{id},1,2.599,,0,4876.6,2001,garmin_push_1840870631,0,0,,0,0,0,,United Kingdom,,0,{id},3.9,1876,0,0,2,07.07.2017 11:17:03,37.573315,-84.281399,(GMT-05:00) America/New_York,0,0,1176232727,1176232727,-14400,2017-07-07,0.74,https://www.strava.com/activities/1072334481
1075205512,Run,,08.07.2017 06:14:39,6.2,"Morning Run with Molly, Paige and Ella (encore)",14.2,1.058,13.4,4.48,9,0.657,21.56,2.78,5.59,0,,,,77.1,,,0,0,everyone,0,,,,,,,311,311,0,0,0,{id},1,1.244,,0,1057.8,1075,garmin_push_1844302298,0,0,,0,0,0,,United Kingdom,,0,{id},2.5,850,0,0,2,08.07.2017 13:14:39,,,(GMT-08:00) America/Los_Angeles,0,1,1179151181,1179151181,-25200,2017-07-08,,https://www.strava.com/activities/1075205512
1075205414,Run,,08.07.2017 08:48:01,8.8,"Morning Run with Molly, Paige and Ella",18.1,1.884,9.63,6.23,12.6,1.17,15.5,3.87,7.83,10.8,5.73,,,75.1,,,0,0,everyone,0,NA-US-KY-Berea,,,0,"[37.573109, -84.281364]","[37.573357, -84.281508]",301.5,310.9,0,0,0,{id},1,1.73,,0,1883.7,1276,garmin_push_1844302161,0,0,,0,0,0,,United Kingdom,,0,{id},3.5,1089,0,0,2,08.07.2017 12:48:01,37.573109,-84.281364,(GMT-05:00) America/New_York,0,0,1179151052,1179151052,-14400,2017-07-08,0.57,https://www.strava.com/activities/1075205414
1075205834,Run,,08.07.2017 09:36:20,9.6,Morning Run with Molly,34.3,4.952,6.93,8.66,12.24,3.077,11.15,5.38,7.61,36.2,7.31,,,80.7,,,0,0,everyone,0,NA-US-KY-Berea,,,0.1,"[37.573325, -84.281478]","[37.573229, -84.283063]",292,314.1,0,0,0,{id},1,2.405,,0,4951.7,2207,garmin_push_1844302626,0,0,,0,0,0,,United Kingdom,,0,{id},3.4,2059,0,0,2,08.07.2017 13:36:20,37.573325,-84.281478,(GMT-05:00) America/New_York,0,0,1179151471,1179151471,-14400,2017-07-08,0.73,https://www.strava.com/activities/1075205834
1075206135,Run,,09.07.2017 09:05:33,9.1,Morning Run with Molly,31.9,4.916,6.49,9.24,17.64,3.054,10.45,5.74,10.96,40.2,8.18,,,81.1,,,0,0,everyone,0,NA-US-KY-Berea,,,0.2,"[37.57286, -84.281292]","[37.573222, -84.283077]",292,314.1,1,0,0,{id},1,2.567,,0,4915.6,1996,garmin_push_1844302982,0,0,,0,0,0,,United Kingdom,,0,{id},4.9,1915,0,0,2,09.07.2017 13:05:33,37.57286,-84.281292,(GMT-05:00) America/New_York,0,0,1179151815,1179151815,-14400,2017-07-09,0.82,https://www.strava.com/activities/1075206135
1076669884,Run,,10.07.2017 06:56:44,6.9,Morning Run with Molly,33,4.868,6.79,8.84,11.88,3.025,10.93,5.49,7.38,31.8,6.53,,,80.1,,,0,0,everyone,0,NA-US-KY-Berea,,,0.1,"[37.573372, -84.281369]","[37.57322, -84.283059]",292,311.2,2,0,1,{id},1,2.455,,0,4868.4,2067,garmin_push_1846158385,0,0,,0,0,0,,United Kingdom,,0,{id},3.3,1983,0,0,2,10.07.2017 10:56:44,37.573372,-84.281369,(GMT-05:00) America/New_York,0,0,1180638396,1180638396,-14400,2017-07-10,0.65,https://www.strava.com/activities/1076669884
1076670025,Run,,10.07.2017 07:33:54,7.6,Morning Run,27.1,4.833,5.61,10.69,14.76,3.003,9.03,6.64,9.17,36,7.45,,,82.9,,,0,0,everyone,,NA-US-KY-Berea,,,0.2,"[37.573426, -84.281399]","[37.573216, -84.283117]",292,314.1,2,0,0,{id},1,2.969,,0,4833.5,1628,garmin_push_1846158545,0,0,,0,0,0,,United Kingdom,,0,{id},4.1,1628,0,0,2,10.07.2017 11:33:54,37.573426,-84.281399,(GMT-05:00) America/New_York,0,0,1180638535,1180638535,-14400,2017-07-10,0.74,https://www.strava.com/activities/1076670025
1110194494,Run,,31.07.2017 06:01:30,6,"First run post-sprain....Molly is no longer the rate-determining runner, but it feels oh so good to be out there again",30.6,4.838,6.32,9.49,12.96,3.006,10.17,5.9,8.05,35.9,7.42,,,80.9,,,0,0,everyone,0,NA-US-KY-Berea,,,0.1,"[37.573378, -84.281679]","[37.573591, -84.283065]",292,314.1,2,0,0,{id},1,2.637,,0,4838.2,1925,garmin_push_1886677325,0,0,,0,0,0,,United Kingdom,,0,{id},3.6,1835,0,0,2,31.07.2017 10:01:30,37.573378,-84.281679,(GMT-05:00) America/New_York,0,0,1214703363,1214703363,-14400,2017-07-31,0.74,https://www.strava.com/activities/1110194494
1111798640,Run,,01.08.2017 05:59:46,6,Morning Run,30.6,4.835,6.33,9.48,16.92,3.005,10.19,5.89,10.51,40.9,8.46,,,80.8,,,0,0,everyone,,NA-US-KY-Berea,,,0.2,"[37.572957, -84.280938]","[37.574114, -84.282997]",292,314.1,2,0,0,{id},1,2.632,,0,4835.5,1881,garmin_push_1888648709,0,0,,0,0,0,,United Kingdom,,0,{id},4.7,1837,0,0,2,01.08.2017 09:59:46,37.572957,-84.280938,(GMT-05:00) America/New_York,0,0,1216330358,1216330358,-14400,2017-08-01,0.85,https://www.strava.com/activities/1111798640
1113550730,Run,,02.08.2017 05:58:54,6,Morning Run,40.5,6.155,6.58,9.12,38.52,3.825,10.59,5.66,23.94,40.7,6.61,,,81.1,,,0,0,everyone,,NA-US-KY-Berea,,,0.2,"[37.573042, -84.281328]","[37.573207, -84.283112]",292,311.2,1,0,1,{id},1,2.532,,0,6155,2450,garmin_push_1891418582,0,0,,0,0,0,,United Kingdom,,0,{id},10.7,2431,0,0,2,02.08.2017 09:58:54,37.573042,-84.281328,(GMT-05:00) America/New_York,0,0,1218111246,1218111246,-14400,2017-08-02,0.66,https://www.strava.com/activities/1113550730
1116087209,Run,,03.08.2017 06:01:25,6,Morning Run,32,4.834,6.61,9.07,14.04,3.004,10.64,5.64,8.72,36.2,7.49,,,81.4,,,0,0,everyone,,NA-US-KY-Berea,,,0.2,"[37.573233, -84.281002]","[37.573774, -84.283055]",292,314.1,0,0,0,{id},1,2.52,,0,4834.3,1968,garmin_push_1894506065,0,0,,0,0,0,,United Kingdom,,0,{id},3.9,1918,0,0,2,03.08.2017 10:01:25,37.573233,-84.281002,(GMT-05:00) America/New_York,0,0,1220677344,1220677344,-14400,2017-08-03,0.75,https://www.strava.com/activities/1116087209
1116648975,Run,,04.08.2017 05:57:16,6,"Molly is so ready for a break. My ankle is stiff, but I'm feeling good!",32.9,4.834,6.81,8.81,13.32,3.004,10.97,5.47,8.28,36.1,7.47,,,81.5,,,0,0,everyone,0,NA-US-KY-Berea,,,0.2,"[37.573364, -84.281402]","[37.573737, -84.283067]",292,314.1,3,0,0,{id},1,2.446,,0,4834,2085,garmin_push_1895184233,0,0,,0,0,0,,United Kingdom,,0,{id},3.7,1976,0,0,2,04.08.2017 09:57:16,37.573364,-84.281402,(GMT-05:00) America/New_York,0,0,1221248737,1221248737,-14400,2017-08-04,0.75,https://www.strava.com/activities/1116648975
1120403191,Run,,06.08.2017 09:49:09,9.8,"Each time I went back home a child/dog decided to, or not to, run with me",52.5,7.128,7.37,8.14,12.6,4.429,11.86,5.06,7.83,53.4,7.49,,,80.9,,,0,0,everyone,0,NA-US-KY-Berea,,,0.2,"[37.573354, -84.281333]","[37.573127, -84.283787]",281,311.2,2,0,2,{id},1,2.262,,0,7128.3,3565,garmin_push_1899792503,0,0,,0,0,0,,United Kingdom,,0,{id},3.5,3151,0,0,2,06.08.2017 13:49:09,37.573354,-84.281333,(GMT-05:00) America/New_York,0,0,1225080862,1225080862,-14400,2017-08-06,0.75,https://www.strava.com/activities/1120403191
1120403575,Run,,06.08.2017 11:07:20,11.1,"Solo, but after long warm-up (see previous upload)",27.9,4.835,5.78,10.39,15.84,3.004,9.3,6.45,9.84,35.8,7.4,,,82.3,,,0,0,everyone,0,NA-US-KY-Berea,,,0.1,"[37.573431, -84.281472]","[37.573146, -84.282955]",292,314.1,2,0,0,{id},1,2.885,,0,4834.7,1718,garmin_push_1899793053,0,0,,0,0,0,,United Kingdom,,0,{id},4.4,1676,0,0,2,06.08.2017 15:07:20,37.573431,-84.281472,(GMT-05:00) America/New_York,0,0,1225081279,1225081279,-14400,2017-08-06,0.74,https://www.strava.com/activities/1120403575
1123104296,Run,,08.08.2017 05:58:04,6,Morning Run,31.9,4.99,6.39,9.39,32.04,3.101,10.29,5.83,19.91,35.8,7.17,,,80.8,,,0,0,everyone,,NA-US-KY-Berea,,,0.2,"[37.572989, -84.280923]","[37.573141, -84.282841]",292,314.1,1,0,0,{id},1,2.607,,0,4990.3,2076,garmin_push_1903233035,0,0,,0,0,0,,United Kingdom,,0,{id},8.9,1914,0,0,2,08.08.2017 09:58:04,37.572989,-84.280923,(GMT-05:00) America/New_York,0,0,1227832578,1227832578,-14400,2017-08-08,0.72,https://www.strava.com/activities/1123104296
1124793473,Run,,09.08.2017 05:59:27,6,Morning Run,54,8.235,6.55,9.16,10.8,5.117,10.54,5.69,6.71,42.8,5.2,,,81.2,,,0,0,everyone,,NA-US-KY-Berea,,,0,"[37.573357, -84.281421]","[37.573319, -84.281715]",292,311.2,1,0,2,{id},1,2.544,,0,8235,3249,garmin_push_1905288064,0,0,,0,0,0,,United Kingdom,,0,{id},3,3237,0,0,2,09.08.2017 09:59:27,37.573357,-84.281421,(GMT-05:00) America/New_York,0,0,1229546184,1229546184,-14400,2017-08-09,0.52,https://www.strava.com/activities/1124793473
1126410363,Run,,10.08.2017 05:56:03,5.9,Morning Run,33.3,4.874,6.84,8.78,16.56,3.028,11,5.45,10.29,36,7.39,,,81,,,0,0,everyone,,NA-US-KY-Berea,,,0.1,"[37.573328, -84.281432]","[37.573217, -84.283101]",292,314.1,1,0,0,{id},1,2.438,,0,4873.8,2098,garmin_push_1907230407,0,0,,0,0,0,,United Kingdom,,0,{id},4.6,1999,0,0,2,10.08.2017 09:56:03,37.573328,-84.281432,(GMT-05:00) America/New_York,0,0,1231187056,1231187056,-14400,2017-08-10,0.74,https://www.strava.com/activities/1126410363
1129570761,Run,,12.08.2017 07:13:49,7.2,Morning Run,43.4,6.816,6.37,9.42,15.48,4.235,10.25,5.85,9.62,31.7,4.65,,,82,,,0,0,everyone,,NA-US-KY-Berea,,,0,"[37.574912, -84.290194]","[37.574907, -84.290133]",286.4,300,1,0,1,{id},1,2.616,,0,6816,2630,garmin_push_1911067834,0,0,,0,0,0,,United Kingdom,,0,{id},4.3,2606,0,0,2,12.08.2017 11:13:49,37.574912,-84.290194,(GMT-05:00) America/New_York,0,0,1234417768,1234417768,-14400,2017-08-12,0.47,https://www.strava.com/activities/1129570761
1131415856,Run,,13.08.2017 07:49:49,7.8,Morning Run,46.7,7.008,6.66,9,11.52,4.355,10.72,5.59,7.16,52.1,7.43,,,81.3,,,0,0,everyone,,NA-US-KY-Berea,,,0.1,"[37.573356, -84.281416]","[37.573153, -84.282718]",281,311.2,0,0,1,{id},1,2.501,,0,7007.9,2905,garmin_push_1913309365,0,0,,0,0,0,,United Kingdom,,0,{id},3.2,2802,0,0,2,13.08.2017 11:49:49,37.573356,-84.281416,(GMT-05:00) America/New_York,0,0,1236304536,1236304536,-14400,2017-08-13,0.74,https://www.strava.com/activities/1131415856
1135507151,Run,,15.08.2017 05:58:56,6,Morning Run,32.9,4.918,6.68,8.98,20.88,3.056,10.75,5.58,12.97,35.9,7.3,,,80.5,,,0,0,everyone,,NA-US-KY-Berea,,,0.2,"[37.573429, -84.281311]","[37.573159, -84.283042]",292,314.1,0,0,0,{id},1,2.494,,0,4918.3,2063,garmin_push_1918420699,0,0,,0,0,0,,United Kingdom,,0,{id},5.8,1972,0,0,2,15.08.2017 09:58:56,37.573429,-84.281311,(GMT-05:00) America/New_York,0,0,1240470197,1240470197,-14400,2017-08-15,0.73,https://www.strava.com/activities/1135507151
1136231262,Run,,16.08.2017 05:12:37,5.2,Morning Run,31.8,4.863,6.53,9.19,14.76,3.022,10.51,5.71,9.17,35.9,7.38,,,81.4,,,0,0,everyone,,NA-US-KY-Berea,,,0.1,"[37.573394, -84.281446]","[37.573263, -84.283096]",292,314.1,1,0,0,{id},1,2.553,,0,4863.2,1961,garmin_push_1919274853,0,0,,0,0,0,,United Kingdom,,0,{id},4.1,1905,0,0,2,16.08.2017 09:12:37,37.573394,-84.281446,(GMT-05:00) America/New_York,0,0,1241203929,1241203929,-14400,2017-08-16,0.74,https://www.strava.com/activities/1136231262
1137921218,Run,,17.08.2017 05:13:23,5.2,"I want to run faster, but feel obligated to take Molly with me ??",31.5,4.92,6.4,9.37,14.4,3.057,10.3,5.82,8.95,36,7.32,,,81.5,,,0,0,everyone,0,NA-US-KY-Berea,,,0.2,"[37.5734, -84.281412]","[37.573274, -84.283119]",292,314.1,0,0,0,{id},1,2.604,,0,4919.9,1996,garmin_push_1921303373,0,0,,0,0,0,,United Kingdom,,0,{id},4,1889,0,0,2,17.08.2017 09:13:23,37.5734,-84.281412,(GMT-05:00) America/New_York,0,0,1242918565,1242918565,-14400,2017-08-17,0.73,https://www.strava.com/activities/1137921218
1140991588,Run,,19.08.2017 06:11:14,6.2,"Molly says, ""Don't give up on me yet!""",49.9,8.084,6.18,9.72,14.04,5.023,9.94,6.04,8.72,42.5,5.26,,,81.5,,,0,0,everyone,0,NA-US-KY-Berea,,,0.2,"[37.57329, -84.281356]","[37.573271, -84.283074]",292,311.2,0,0,2,{id},1,2.699,,0,8084.4,3082,garmin_push_1925145208,0,0,,0,0,0,,United Kingdom,,0,{id},3.9,2995,0,0,2,19.08.2017 10:11:14,37.57329,-84.281356,(GMT-05:00) America/New_York,0,0,1246033389,1246033389,-14400,2017-08-19,0.53,https://www.strava.com/activities/1140991588
1147223164,Run,,22.08.2017 08:21:03,8.4,Short run with first year students at orientation,17.3,3.084,5.61,10.7,13.68,1.916,9.03,6.65,8.5,15,4.86,,,81.1,,,0,0,everyone,0,NA-US-KY-Berea,,,0,"[37.574279, -84.290177]","[37.574298, -84.290037]",292,304,0,0,0,{id},1,2.971,,0,3084.1,1065,garmin_push_1932834347,0,0,,0,0,0,,United Kingdom,,0,{id},3.8,1038,0,0,2,22.08.2017 12:21:03,37.574279,-84.290177,(GMT-05:00) America/New_York,0,0,1252381137,1252381137,-14400,2017-08-22,0.49,https://www.strava.com/activities/1147223164
1147674563,Run,,23.08.2017 05:13:05,5.2,Morning Run,31,4.884,6.34,9.46,18.36,3.035,10.2,5.88,11.41,36.2,7.41,,,81.7,,,0,0,everyone,,NA-US-KY-Berea,,,0.2,"[37.573338, -84.281325]","[37.573271, -84.283072]",292,314.1,1,0,0,{id},1,2.629,,0,4884.2,1919,garmin_push_1933356530,0,0,,0,0,0,,United Kingdom,,0,{id},5.1,1858,0,0,2,23.08.2017 09:13:05,37.573338,-84.281325,(GMT-05:00) America/New_York,0,0,1252839109,1252839109,-14400,2017-08-23,0.74,https://www.strava.com/activities/1147674563
1149400317,Run,,24.08.2017 05:13:55,5.2,You can see the blip on the path where I had a head-on collision with a cyclist that threw me to the ground,39.1,6.444,6.07,9.89,11.16,4.004,9.77,6.14,6.93,34.5,5.35,,,82,,,0,0,everyone,0,NA-US-KY-Berea,,,0.1,"[37.573393, -84.281433]","[37.573165, -84.282626]",292,311.2,1,4,1,{id},1,2.746,,0,6444.4,2727,garmin_push_1935417427,0,0,,0,0,0,,United Kingdom,,0,{id},3.1,2347,0,1,2,24.08.2017 09:13:55,37.573393,-84.281433,(GMT-05:00) America/New_York,0,0,1254584781,1254584781,-14400,2017-08-24,0.54,https://www.strava.com/activities/1149400317
1157899422,Run,,29.08.2017 07:07:58,7.1,Morning Run,40.7,6.935,5.87,10.21,16.92,4.309,9.45,6.35,10.51,35.3,5.09,,,81.9,,,0,0,everyone,,NA-US-KY-Berea,,,0,"[37.574216, -84.290217]","[37.574264, -84.290049]",286.1,304,2,0,1,{id},2,2.837,,0,6934.8,2484,garmin_push_1945795500,0,0,,0,0,0,,United Kingdom,,0,{id},4.7,2444,0,0,2,29.08.2017 11:07:58,37.574216,-84.290217,(GMT-05:00) America/New_York,0,0,1263196711,1263196711,-14400,2017-08-29,0.51,https://www.strava.com/activities/1157899422
1159469927,Run,,30.08.2017 05:16:45,5.3,Morning Run,30.6,4.891,6.25,9.6,19.44,3.039,10.06,5.97,12.08,35.8,7.32,,,80.7,,,0,0,everyone,,NA-US-KY-Berea,,,0.2,"[37.573514, -84.281108]","[37.573293, -84.283067]",292,314.1,0,0,0,{id},1,2.667,,0,4890.9,1925,garmin_push_1947658938,0,0,,0,0,0,,United Kingdom,,0,{id},5.4,1834,0,0,2,30.08.2017 09:16:45,37.573514,-84.281108,(GMT-05:00) America/New_York,0,0,1264781366,1264781366,-14400,2017-08-30,0.73,https://www.strava.com/activities/1159469927
1161216049,Run,,31.08.2017 07:03:23,7.1,Morning Run,39.7,6.924,5.74,10.46,17.28,4.302,9.23,6.5,10.74,34.3,4.95,,,82,,,0,0,everyone,,NA-US-KY-Berea,,,0,"[37.574226, -84.290293]","[37.574399, -84.289962]",286.4,304.8,2,0,1,{id},2,2.905,,0,6923.6,2420,garmin_push_1949765163,0,0,,0,0,0,,United Kingdom,,0,{id},4.8,2383,0,0,2,31.08.2017 11:03:23,37.574226,-84.290293,(GMT-05:00) America/New_York,0,0,1266532431,1266532431,-14400,2017-08-31,0.5,https://www.strava.com/activities/1161216049
1164379561,Run,,02.09.2017 08:09:02,8.2,Morning Run,70.1,11.372,6.16,9.73,14.04,7.066,9.92,6.05,8.72,82.1,7.22,,,82.7,,,0,0,everyone,,NA-US-KY-Berea,,,0.2,"[37.573088, -84.281342]","[37.573561, -84.283]",281,317.8,1,0,0,{id},1,2.704,,0,11372.4,4913,garmin_push_1953609448,0,0,,0,0,0,,United Kingdom,,0,{id},3.9,4205,0,0,2,02.09.2017 12:09:02,37.573088,-84.281342,(GMT-05:00) America/New_York,0,0,1269730584,1269730584,-14400,2017-09-02,0.72,https://www.strava.com/activities/1164379561
1166327323,Run,,03.09.2017 09:09:08,9.2,Morning Run,50,8.07,6.19,9.69,12.6,5.015,9.96,6.02,7.83,56.3,6.98,,,82.2,,,0,0,everyone,,NA-US-KY-Berea,,,0.1,"[37.573066, -84.281289]","[37.57325, -84.282319]",275,309,2,0,1,{id},1,2.693,,0,8070.5,3035,garmin_push_1955969169,0,0,,0,0,0,,United Kingdom,,0,{id},3.5,2997,0,1,2,03.09.2017 13:09:08,37.573066,-84.281289,(GMT-05:00) America/New_York,0,0,1271713557,1271713557,-14400,2017-09-03,0.7,https://www.strava.com/activities/1166327323
1169296718,Run,,05.09.2017 07:03:05,7.1,Morning Run,40.7,6.931,5.88,10.21,16.56,4.307,9.46,6.34,10.29,34,4.91,,,82.5,,,0,0,everyone,,NA-US-KY-Berea,,,0,"[37.574241, -84.290227]","[37.574333, -84.290009]",286.3,303.3,1,0,1,{id},1,2.836,,0,6931.5,2444,garmin_push_1959674231,0,0,,0,0,0,,United Kingdom,,0,{id},4.6,2444,0,0,2,05.09.2017 11:03:05,37.574241,-84.290227,(GMT-05:00) America/New_York,0,0,1274715760,1274715760,-14400,2017-09-05,0.49,https://www.strava.com/activities/1169296718
1170759662,Run,,06.09.2017 05:13:53,5.2,Morning Run,30.5,4.88,6.25,9.6,12.96,3.032,10.05,5.97,8.05,35.8,7.34,,,80.8,,,0,0,everyone,,NA-US-KY-Berea,,,0.1,"[37.573394, -84.281403]","[37.573205, -84.283085]",292,314.1,1,0,0,{id},1,2.668,,0,4880.2,1924,garmin_push_1961443191,0,0,,0,0,0,,United Kingdom,,0,{id},3.6,1829,0,0,2,06.09.2017 09:13:53,37.573394,-84.281403,(GMT-05:00) America/New_York,0,0,1276199550,1276199550,-14400,2017-09-06,0.73,https://www.strava.com/activities/1170759662
1172511492,Run,,07.09.2017 07:03:29,7.1,Morning Run,39.3,6.931,5.67,10.59,15.48,4.307,9.12,6.58,9.62,33.8,4.88,,,82.4,,,0,0,everyone,,NA-US-KY-Berea,,,0,"[37.574244, -84.290289]","[37.574426, -84.289962]",286.3,305,2,0,1,{id},1,2.942,,0,6930.9,2446,garmin_push_1963560141,0,0,,0,0,0,,United Kingdom,,0,{id},4.3,2356,0,0,2,07.09.2017 11:03:29,37.574244,-84.290289,(GMT-05:00) America/New_York,0,0,1277971295,1277971295,-14400,2017-09-07,0.49,https://www.strava.com/activities/1172511492
1176316391,Hike,,09.09.2017 08:00:11,8,Morning Run/Hike,68.8,6.48,10.62,5.65,13.68,4.027,17.08,3.51,8.5,354,54.63,,,72,,,0,0,everyone,,NA-US-KY-Parkers Lake,,,0.3,"[36.837793, -84.338025]","[36.839969, -84.340202]",232.4,332.9,1,3,2,{id},2,1.57,,0,6480.3,4264,garmin_push_1968159155,0,0,,0,0,0,,United Kingdom,,0,{id},3.8,4128,0,1,2,09.09.2017 12:00:11,36.837793,-84.338025,(GMT-05:00) America/New_York,3,0,1281831701,1281831701,-14400,2017-09-09,5.46,https://www.strava.com/activities/1176316391
1177412941,Run,,10.09.2017 07:21:49,7.4,Morning Run,75.8,12.909,5.87,10.22,12.6,8.022,9.45,6.35,7.83,70.3,5.45,,,83.2,,,0,0,everyone,,NA-US-KY-Berea,,,0.2,"[37.573369, -84.281308]","[37.573155, -84.283002]",279.1,316.1,2,0,2,{id},1,2.839,,0,12909.5,4835,garmin_push_1969463056,0,0,,0,0,0,,United Kingdom,,0,{id},3.5,4548,0,1,2,10.09.2017 11:21:49,37.573369,-84.281308,(GMT-05:00) America/New_York,0,0,1282951315,1282951315,-14400,2017-09-10,0.54,https://www.strava.com/activities/1177412941
1186651464,Run,,16.09.2017 09:05:15,9.1,Spoonbread 5K Race,25,4.942,5.06,11.87,18.36,3.071,8.14,7.38,11.41,19.7,3.99,,,82.9,,,0,0,everyone,0,NA-US-KY-Berea,,,0,"[37.578667, -84.295238]","[37.578534, -84.295579]",286,299.5,4,3,1,{id},2,3.297,,0,4941.6,1499,garmin_push_1980687173,0,0,,0,0,0,,United Kingdom,,0,{id},5.1,1499,0,0,2,16.09.2017 13:05:15,37.578667,-84.295238,(GMT-05:00) America/New_York,1,0,1292304769,1292304769,-14400,2017-09-16,0.4,https://www.strava.com/activities/1186651464
1188239862,Run,,17.09.2017 07:47:26,7.8,Morning Run,52.3,8.856,5.9,10.17,12.96,5.503,9.5,6.32,8.05,63.6,7.18,,,82,,,0,0,everyone,,NA-US-KY-Berea,,,0.1,"[37.573356, -84.28146]","[37.57322, -84.283017]",281.3,314.1,0,0,0,{id},1,2.824,,0,8855.8,3272,garmin_push_1982527081,0,0,,0,0,0,,United Kingdom,,0,{id},3.6,3136,0,0,2,17.09.2017 11:47:26,37.573356,-84.28146,(GMT-05:00) America/New_York,0,0,1293924735,1293924735,-14400,2017-09-17,0.72,https://www.strava.com/activities/1188239862
1191235307,Run,,19.09.2017 07:02:57,7,Morning Run,38.5,6.935,5.55,10.81,14.04,4.309,8.93,6.72,8.72,32.3,4.66,,,82.8,,,0,0,everyone,,NA-US-KY-Berea,,,0,"[37.574229, -84.290234]","[37.574368, -84.289846]",286.3,303.2,1,0,1,{id},1,3.004,,0,6935.2,2335,garmin_push_1986266712,0,0,,0,0,0,,United Kingdom,,0,{id},3.9,2309,0,0,2,19.09.2017 11:02:57,37.574229,-84.290234,(GMT-05:00) America/New_York,0,0,1296965308,1296965308,-14400,2017-09-19,0.47,https://www.strava.com/activities/1191235307
1192697371,Run,,20.09.2017 05:11:54,5.2,Morning Run,31.1,4.861,6.41,9.36,16.2,3.02,10.31,5.82,10.07,36,7.41,,,81.3,,,0,0,everyone,,NA-US-KY-Berea,,,0.1,"[37.573356, -84.281455]","[37.573211, -84.283047]",292,314.1,1,0,0,{id},1,2.601,,0,4860.6,1966,garmin_push_1987944832,0,0,,0,0,0,,United Kingdom,,0,{id},4.5,1869,0,0,2,20.09.2017 09:11:54,37.573356,-84.281455,(GMT-05:00) America/New_York,0,0,1298452748,1298452748,-14400,2017-09-20,0.74,https://www.strava.com/activities/1192697371
1194348127,Run,,21.09.2017 07:02:48,7,Morning Run,20.9,3.752,5.57,10.78,12.24,2.331,8.96,6.7,7.61,26,6.93,,,81.3,,,0,0,everyone,,NA-US-KY-Berea,,,0.6,"[37.574292, -84.290235]","[37.573185, -84.283199]",292,311.2,2,0,1,{id},1,2.994,,0,3752.1,1260,garmin_push_1989874867,0,0,,0,0,0,,United Kingdom,,0,{id},3.4,1253,0,1,2,21.09.2017 11:02:48,37.574292,-84.290235,(GMT-05:00) America/New_York,0,0,1300123757,1300123757,-14400,2017-09-21,0.69,https://www.strava.com/activities/1194348127
1197787811,Run,,23.09.2017 08:01:27,8,Morning Run,53.5,8.908,6,10,15.48,5.535,9.66,6.21,9.62,64.2,7.21,,,82.5,,,0,0,everyone,,NA-US-KY-Berea,,,0.1,"[37.573292, -84.281376]","[37.573223, -84.283057]",281,314.1,1,0,0,{id},1,2.777,,0,8907.6,3241,garmin_push_1993969566,0,0,,0,0,0,,United Kingdom,,0,{id},4.3,3208,0,0,2,23.09.2017 12:01:27,37.573292,-84.281376,(GMT-05:00) America/New_York,0,0,1303623175,1303623175,-14400,2017-09-23,0.72,https://www.strava.com/activities/1197787811
1199369271,Run,,24.09.2017 08:02:34,8,Morning Run,57.5,6.448,8.91,6.73,11.52,4.007,14.34,4.18,7.16,175.3,27.19,,,76.9,,,0,0,everyone,,NA-US-KY-Berea,,,0.8,"[37.569603, -84.289557]","[37.573388, -84.281448]",285.5,386.9,2,0,1,{id},1,1.87,,0,6448.1,3453,garmin_push_1995803798,0,0,,0,0,0,,United Kingdom,,0,{id},3.2,3448,0,0,2,24.09.2017 12:02:34,37.569603,-84.289557,(GMT-05:00) America/New_York,0,0,1305233986,1305233986,-14400,2017-09-24,2.72,https://www.strava.com/activities/1199369271
1203293276,Run,,26.09.2017 07:01:51,7,Morning Run,37.7,6.955,5.43,11.06,19.44,4.322,8.73,6.87,12.08,32.6,4.69,,,82.3,,,0,0,everyone,,NA-US-KY-Berea,,,0,"[37.574212, -84.290316]","[37.574262, -84.289896]",286.5,304.9,2,0,1,{id},1,3.072,,0,6955.4,2343,garmin_push_2003976612,0,0,,0,0,0,,United Kingdom,,0,{id},5.4,2264,0,0,2,26.09.2017 11:01:51,37.574212,-84.290316,(GMT-05:00) America/New_York,0,0,1309202788,1309202788,-14400,2017-09-26,0.47,https://www.strava.com/activities/1203293276
1203882685,Run,,27.09.2017 05:14:04,5.2,Morning Run,29.2,4.927,5.94,10.11,16.92,3.061,9.56,6.28,10.51,36,7.31,,,81.4,,,0,0,everyone,,NA-US-KY-Berea,,,0.1,"[37.573351, -84.281365]","[37.57322, -84.283043]",292,314.1,2,0,0,{id},1,2.807,,0,4926.9,1839,garmin_push_2006070787,0,0,,0,0,0,,United Kingdom,,0,{id},4.7,1755,0,0,2,27.09.2017 09:14:04,37.573351,-84.281365,(GMT-05:00) America/New_York,0,0,1309797823,1309797823,-14400,2017-09-27,0.73,https://www.strava.com/activities/1203882685
1210397581,Run,,01.10.2017 08:15:24,8.3,Morning Run,64.9,11.216,5.79,10.37,35.28,6.969,9.31,6.44,21.92,91.8,8.18,,,82.8,,,0,0,everyone,,NA-US-KY-Berea,,,0.3,"[37.573387, -84.286707]","[37.573273, -84.283032]",277.1,311.2,2,0,1,{id},1,2.88,,0,11215.6,4182,garmin_push_2026894510,0,0,,0,0,0,,United Kingdom,,0,{id},9.8,3894,0,0,2,01.10.2017 12:15:24,37.573387,-84.286707,(GMT-05:00) America/New_York,0,0,1316402194,1316402194,-14400,2017-10-01,0.82,https://www.strava.com/activities/1210397581
1213325868,Run,,03.10.2017 07:02:14,7,I love how running with college students pushes me...Molly agrees.,37,6.921,5.34,11.23,18.36,4.3,8.6,6.98,11.41,32.6,4.71,,,82.4,,,0,0,everyone,0,NA-US-KY-Berea,,,0,"[37.574276, -84.290248]","[37.574262, -84.28979]",286.5,303.8,2,2,1,{id},1,3.12,,0,6920.9,2242,garmin_push_2037510361,0,0,,0,0,0,,United Kingdom,,0,{id},5.1,2218,0,1,2,03.10.2017 11:02:14,37.574276,-84.290248,(GMT-05:00) America/New_York,0,0,1319363312,1319363312,-14400,2017-10-03,0.47,https://www.strava.com/activities/1213325868
1214544709,Run,,04.10.2017 05:14:50,5.2,Morning Run,29.4,4.879,6.04,9.94,18.72,3.032,9.71,6.18,11.63,35.9,7.36,,,81.6,,,0,0,everyone,,NA-US-KY-Berea,,,0.1,"[37.573391, -84.281499]","[37.573246, -84.283087]",292,314.1,0,0,0,{id},1,2.761,,0,4879.2,1851,garmin_push_2041303707,0,0,,0,0,0,,United Kingdom,,0,{id},5.2,1767,0,0,2,04.10.2017 09:14:50,37.573391,-84.281499,(GMT-05:00) America/New_York,0,0,1320592706,1320592706,-14400,2017-10-04,0.74,https://www.strava.com/activities/1214544709
1216300574,Run,,05.10.2017 07:01:47,7,Morning Run,38.6,6.915,5.58,10.75,18,4.297,8.98,6.68,11.18,33.4,4.83,,,82.7,,,0,0,everyone,,NA-US-KY-Berea,,,0,"[37.574265, -84.290323]","[37.574395, -84.289975]",286.2,304.6,2,0,0,{id},1,2.987,,0,6915,2355,garmin_push_2047551542,0,0,,0,0,0,,United Kingdom,,0,{id},5,2315,0,0,2,05.10.2017 11:01:47,37.574265,-84.290323,(GMT-05:00) America/New_York,0,0,1322363922,1322363922,-14400,2017-10-05,0.48,https://www.strava.com/activities/1216300574
1218998666,Run,,07.10.2017 07:15:39,7.3,Morning Run,28.8,4.856,5.92,10.13,16.56,3.017,9.54,6.29,10.29,36.1,7.43,,,81.2,,,0,0,everyone,,NA-US-KY-Berea,,,0.1,"[37.57357, -84.28144]","[37.57326, -84.283046]",292,314.1,0,0,0,{id},1,2.813,,0,4856,1811,garmin_push_2058849255,0,0,,0,0,0,,United Kingdom,,0,{id},4.6,1726,0,0,2,07.10.2017 11:15:39,37.57357,-84.28144,(GMT-05:00) America/New_York,0,0,1325098222,1325098222,-14400,2017-10-07,0.74,https://www.strava.com/activities/1218998666
1221602957,Hike,,08.10.2017 15:16:01,15.3,"We went up first, but I forgot to start my GPS. I promise!",45.6,2.471,18.46,3.25,6.48,1.536,29.7,2.02,4.03,36.3,14.69,,,55.6,,,0,0,everyone,,NA-US-KY-Kenvir,,,1,"[36.946326, -83.171872]","[36.946475, -83.1829]",533,867.3,0,0,0,{id},1,0.903,,0,2471.3,2807,garmin_push_2069739906,0,0,,0,0,0,,United Kingdom,,0,{id},1.8,2738,0,0,2,08.10.2017 19:16:01,36.946326,-83.171872,(GMT-05:00) America/New_York,0,0,1327752144,1327752144,-14400,2017-10-08,1.47,https://www.strava.com/activities/1221602957
1223885071,Run,,10.10.2017 07:03:27,7.1,Morning Run,40.2,6.931,5.8,10.35,15.84,4.307,9.33,6.43,9.84,32.8,4.73,,,81.4,,,0,0,everyone,,NA-US-KY-Berea,,,0,"[37.57432, -84.290269]","[37.574384, -84.289895]",286.1,304.2,1,0,0,{id},1,2.875,,0,6931.3,2411,garmin_push_2081349109,0,0,,0,0,0,,United Kingdom,,0,{id},4.4,2411,0,0,2,10.10.2017 11:03:27,37.57432,-84.290269,(GMT-05:00) America/New_York,0,0,1330055397,1330055397,-14400,2017-10-10,0.47,https://www.strava.com/activities/1223885071
1225060300,Run,,11.10.2017 05:12:43,5.2,Morning Run,29,4.914,5.9,10.17,23.04,3.053,9.5,6.32,14.32,50.5,10.28,,,81.2,,,0,0,everyone,,NA-US-KY-Berea,,,0.3,"[37.570773, -84.282924]","[37.573274, -84.283063]",291,314.1,3,0,0,{id},1,2.824,,0,4913.7,1836,garmin_push_2085521525,0,0,,0,0,0,,United Kingdom,,0,{id},6.4,1740,0,0,2,11.10.2017 09:12:43,37.570773,-84.282924,(GMT-05:00) America/New_York,0,0,1331238179,1331238179,-14400,2017-10-11,1.03,https://www.strava.com/activities/1225060300
1227690829,Run,,12.10.2017 07:00:18,7,Morning Run,21.5,3.782,5.69,10.54,13.32,2.35,9.16,6.55,8.28,25.8,6.82,,,81.1,,,0,0,everyone,,NA-US-KY-Berea,,,0.6,"[37.574277, -84.2903]","[37.573202, -84.283274]",292,311.1,0,0,1,{id},1,2.927,,0,3781.9,1324,garmin_push_2096909843,0,0,,0,0,0,,United Kingdom,,0,{id},3.7,1292,0,0,2,12.10.2017 11:00:18,37.574277,-84.2903,(GMT-05:00) America/New_York,0,0,1333886993,1333886993,-14400,2017-10-12,0.68,https://www.strava.com/activities/1227690829
1229623196,Run,,14.10.2017 08:13:03,8.2,Morning Run,50.1,8.856,5.66,10.61,28.44,5.503,9.1,6.59,17.67,63.9,7.22,,,82.2,,,0,0,everyone,,NA-US-KY-Berea,,,0.2,"[37.572704, -84.284777]","[37.573277, -84.283032]",281.1,314.1,1,0,0,{id},1,2.947,,0,8856.3,3094,garmin_push_2106202734,0,0,,0,0,0,,United Kingdom,,0,{id},7.9,3005,0,0,2,14.10.2017 12:13:03,37.572704,-84.284777,(GMT-05:00) America/New_York,0,0,1335850047,1335850047,-14400,2017-10-14,0.72,https://www.strava.com/activities/1229623196
1232216174,Run,,15.10.2017 08:01:09,8,Morning Run,28,4.864,5.76,10.42,15.12,3.022,9.27,6.47,9.4,35.9,7.38,,,81.5,,,0,0,everyone,,NA-US-KY-Berea,,,0.1,"[37.573367, -84.28141]","[37.573257, -84.283037]",292,314.1,2,0,0,{id},1,2.894,,0,4864.2,1730,garmin_push_2116874038,0,0,,0,0,0,,United Kingdom,,0,{id},4.2,1681,0,0,2,15.10.2017 12:01:09,37.573367,-84.28141,(GMT-05:00) America/New_York,0,0,1338495659,1338495659,-14400,2017-10-15,0.74,https://www.strava.com/activities/1232216174
1234346046,Run,,17.10.2017 07:03:57,7.1,Morning Run,38.3,6.92,5.54,10.83,17.28,4.3,8.91,6.73,10.74,33.2,4.8,,,82.8,,,0,0,everyone,,NA-US-KY-Berea,,,0,"[37.574307, -84.290279]","[37.5744, -84.289922]",286.3,305.1,0,0,0,{id},1,3.009,,0,6920.4,2328,garmin_push_2128225934,0,0,,0,0,0,,United Kingdom,,0,{id},4.8,2300,0,0,2,17.10.2017 11:03:57,37.574307,-84.290279,(GMT-05:00) America/New_York,0,0,1340652390,1340652390,-14400,2017-10-17,0.48,https://www.strava.com/activities/1234346046
1236895516,Hike,,18.10.2017 08:37:09,8.6,Mountain Day,113.8,7.952,14.31,4.19,9,4.941,23.02,2.61,5.59,350.2,44.04,,,57,,,0,0,everyone,,NA-US-KY-Berea,,,0,"[37.554088, -84.240887]","[37.554306, -84.240788]",306.9,472.1,4,0,1,{id},1,1.165,,0,7952,7037,garmin_push_2138911471,0,0,,0,0,0,,United Kingdom,,0,{id},2.5,6827,0,0,2,18.10.2017 12:37:09,37.554088,-84.240887,(GMT-05:00) America/New_York,4,0,1343220225,1343220225,-14400,2017-10-18,4.4,https://www.strava.com/activities/1236895516
1237357013,Run,,19.10.2017 07:04:09,7.1,Morning Run,21.2,3.797,5.57,10.76,12.6,2.359,8.97,6.69,7.83,26,6.85,,,81.1,,,0,0,everyone,,NA-US-KY-Berea,,,0.7,"[37.574326, -84.290305]","[37.573176, -84.282741]",292.1,311.2,1,0,1,{id},1,2.99,,0,3797.2,1299,garmin_push_2140267695,0,0,,0,0,0,,United Kingdom,,0,{id},3.5,1270,0,0,2,19.10.2017 11:04:09,37.574326,-84.290305,(GMT-05:00) America/New_York,0,0,1343684359,1343684359,-14400,2017-10-19,0.68,https://www.strava.com/activities/1237357013
1240942434,Run,,21.10.2017 16:05:18,16.1,Afternoon Run,43.6,7.397,5.89,10.18,15.12,4.596,9.48,6.33,9.4,51.5,6.96,,,80.8,,,0,0,everyone,,NA-US-KY-Berea,,,0.2,"[37.573382, -84.28131]","[37.573337, -84.283057]",286,317.8,2,0,0,{id},1,2.828,,0,7397.3,2773,garmin_push_2160680794,0,0,,0,0,0,,United Kingdom,,0,{id},4.2,2616,0,0,2,21.10.2017 20:05:18,37.573382,-84.28131,(GMT-05:00) America/New_York,0,0,1347311758,1347311758,-14400,2017-10-21,0.7,https://www.strava.com/activities/1240942434
1242014556,Run,,22.10.2017 08:16:31,8.3,Morning Run,79.5,13.018,6.11,9.82,12.6,8.089,9.83,6.1,7.83,70.7,5.43,,,82.3,,,0,0,everyone,,NA-US-KY-Berea,,,0.1,"[37.573395, -84.281372]","[37.5733, -84.283054]",279,316,2,0,2,{id},1,2.728,,0,13018.2,4824,garmin_push_2165554311,0,0,,0,0,0,,United Kingdom,,0,{id},3.5,4772,0,0,2,22.10.2017 12:16:31,37.573395,-84.281372,(GMT-05:00) America/New_York,0,0,1348405785,1348405785,-14400,2017-10-22,0.54,https://www.strava.com/activities/1242014556
1245341746,Run,,24.10.2017 07:02:43,7,Morning Run,39.4,6.909,5.7,10.52,18.36,4.293,9.18,6.54,11.41,33.9,4.91,,,82.7,,,0,0,everyone,,NA-US-KY-Berea,,,0,"[37.574333, -84.2902]","[37.574389, -84.289926]",286.3,303.6,2,0,0,{id},1,2.923,,0,6909.4,2364,garmin_push_2184098606,0,0,,0,0,0,,United Kingdom,,0,{id},5.1,2364,0,0,2,24.10.2017 11:02:43,37.574333,-84.2902,(GMT-05:00) America/New_York,0,0,1351773312,1351773312,-14400,2017-10-24,0.49,https://www.strava.com/activities/1245341746
1245953781,Run,,25.10.2017 05:13:24,5.2,Morning Run,28.6,4.902,5.83,10.3,21.6,3.046,9.38,6.4,13.42,36.2,7.38,,,82.4,,,0,0,everyone,,NA-US-KY-Berea,,,0.2,"[37.573392, -84.281191]","[37.573226, -84.283037]",292,314.1,2,0,0,{id},1,2.86,,0,4902.1,1747,garmin_push_2187571750,0,0,,0,0,0,,United Kingdom,,0,{id},6,1714,0,0,2,25.10.2017 09:13:24,37.573392,-84.281191,(GMT-05:00) America/New_York,0,0,1352390249,1352390249,-14400,2017-10-25,0.74,https://www.strava.com/activities/1245953781
1247515099,Run,,26.10.2017 07:02:38,7,Morning Run,22.8,3.95,5.76,10.42,12.6,2.454,9.27,6.47,7.83,28.1,7.11,,,81.8,,,0,0,everyone,,NA-US-KY-Berea,,,0.8,"[37.574298, -84.290364]","[37.573317, -84.281605]",292,311.1,1,0,1,{id},1,2.894,,0,3950.1,1391,garmin_push_2197829604,0,0,,0,0,0,,United Kingdom,,0,{id},3.5,1365,0,0,2,26.10.2017 11:02:38,37.574298,-84.290364,(GMT-05:00) America/New_York,0,0,1353965486,1353965486,-14400,2017-10-26,0.71,https://www.strava.com/activities/1247515099
1250415178,Run,,28.10.2017 08:17:02,8.3,Morning Run,66.2,11.323,5.85,10.26,20.16,7.036,9.41,6.38,12.53,79.1,6.99,,,83.6,,,0,0,everyone,,NA-US-KY-Berea,,,0.1,"[37.573491, -84.28131]","[37.573229, -84.282116]",281,317.8,2,0,0,{id},1,2.851,,0,11322.8,4040,garmin_push_2217854933,0,0,,0,0,0,,United Kingdom,,0,{id},5.6,3972,0,0,2,28.10.2017 12:17:02,37.573491,-84.28131,(GMT-05:00) America/New_York,0,0,1356892750,1356892750,-14400,2017-10-28,0.7,https://www.strava.com/activities/1250415178
1252012805,Run,,29.10.2017 08:19:18,8.3,Morning Run,27.9,4.901,5.7,10.53,15.48,3.046,9.17,6.55,9.62,36.1,7.37,,,82.5,,,0,0,everyone,,NA-US-KY-Berea,,,0.1,"[37.573432, -84.281475]","[37.573297, -84.283013]",292,314.1,3,0,0,{id},1,2.926,,0,4901.4,1824,garmin_push_2227742303,0,0,,0,0,0,,United Kingdom,,0,{id},4.3,1675,0,0,2,29.10.2017 12:19:18,37.573432,-84.281475,(GMT-05:00) America/New_York,0,0,1358515111,1358515111,-14400,2017-10-29,0.74,https://www.strava.com/activities/1252012805
1256006538,Run,,31.10.2017 07:02:13,7,Morning Run,39.6,6.931,5.71,10.51,15.84,4.306,9.19,6.53,9.84,33,4.76,,,82.4,,,0,0,everyone,,NA-US-KY-Berea,,,0,"[37.574254, -84.290221]","[37.57436, -84.289944]",286.2,303.6,1,0,0,{id},1,2.919,,0,6930.6,2399,garmin_push_2255319075,0,0,,0,0,0,,United Kingdom,,0,{id},4.4,2374,0,0,2,31.10.2017 11:02:13,37.574254,-84.290221,(GMT-05:00) America/New_York,0,0,1362543591,1362543591,-14400,2017-10-31,0.48,https://www.strava.com/activities/1256006538
1256006753,Run,,01.11.2017 05:15:37,5.3,Morning Run,30.6,4.862,6.29,9.53,14.76,3.021,10.13,5.92,9.17,35.9,7.38,,,82,,,0,0,everyone,,NA-US-KY-Berea,,,0.1,"[37.573494, -84.281505]","[37.573269, -84.283077]",292,314.1,0,0,0,{id},1,2.648,,0,4861.8,1940,garmin_push_2255319312,0,0,,0,0,0,,United Kingdom,,0,{id},4.1,1836,0,0,2,01.11.2017 09:15:37,37.573494,-84.281505,(GMT-05:00) America/New_York,0,0,1362543803,1362543803,-14400,2017-11-01,0.74,https://www.strava.com/activities/1256006753
1257695111,Run,,02.11.2017 07:03:38,7.1,Morning Run,39.9,6.932,5.76,10.41,16.92,4.308,9.27,6.47,10.51,32.6,4.7,,,83.1,,,0,0,everyone,,NA-US-KY-Berea,,,0,"[37.574317, -84.290188]","[37.574309, -84.289863]",286.5,303.5,2,0,0,{id},1,2.893,,0,6932.4,2396,garmin_push_2265729316,0,0,,0,0,0,,United Kingdom,,0,{id},4.7,2396,0,0,2,02.11.2017 11:03:38,37.574317,-84.290188,(GMT-05:00) America/New_York,0,0,1364250568,1364250568,-14400,2017-11-02,0.47,https://www.strava.com/activities/1257695111
1261585036,Run,,04.11.2017 16:00:31,16,Afternoon Run,44.5,7.047,6.32,9.49,14.4,4.379,10.18,5.9,8.95,52.4,7.44,,,80.6,,,0,0,everyone,,NA-US-KY-Berea,,,0.2,"[37.573461, -84.28133]","[37.573211, -84.283024]",281,311.2,2,0,0,{id},1,2.636,,0,7046.7,2986,garmin_push_2290220137,0,0,,0,0,0,,United Kingdom,,0,{id},4,2673,0,0,2,04.11.2017 20:00:31,37.573461,-84.28133,(GMT-05:00) America/New_York,0,0,1368191306,1368191306,-14400,2017-11-04,0.74,https://www.strava.com/activities/1261585036
1264449366,Run,,05.11.2017 07:57:00,8,Morning Run,41.4,6.877,6.02,9.96,15.84,4.273,9.69,6.19,9.84,50.3,7.31,,,82.2,,,0,0,everyone,,NA-US-KY-Berea,,,0.1,"[37.573363, -84.281402]","[37.573222, -84.283059]",291,317.9,1,0,0,{id},1,2.767,,0,6876.8,2596,garmin_push_2295563785,0,0,,0,0,0,,United Kingdom,,0,{id},4.4,2485,0,0,2,05.11.2017 12:57:00,37.573363,-84.281402,(GMT-05:00) America/New_York,0,0,1369019803,1369019803,-18000,2017-11-05,0.73,https://www.strava.com/activities/1264449366
1265006795,Run,,07.11.2017 05:42:17,5.7,Morning Run,48.2,7.989,6.03,9.94,12.6,4.964,9.71,6.18,7.83,95.1,11.9,,,80.7,,,0,0,everyone,,NA-US-KY-Berea,,,0.1,"[37.573427, -84.281444]","[37.573802, -84.283008]",293.8,311.2,2,0,0,{id},1,2.762,,0,7989,3000,garmin_push_2313227596,0,0,,0,0,0,,United Kingdom,,0,{id},3.5,2892,0,0,2,07.11.2017 10:42:17,37.573427,-84.281444,(GMT-05:00) America/New_York,0,0,1371647330,1371647330,-18000,2017-11-07,1.19,https://www.strava.com/activities/1265006795
1266418758,Run,,08.11.2017 05:20:33,5.3,Morning Run,28.3,4.865,5.82,10.31,17.64,3.023,9.36,6.41,10.96,35.9,7.38,,,81.7,,,0,0,everyone,,NA-US-KY-Berea,,,0.1,"[37.57345, -84.281384]","[37.573208, -84.283048]",292,314.1,0,0,0,{id},1,2.865,,0,4864.7,1795,garmin_push_2319670956,0,0,,0,0,0,,United Kingdom,,0,{id},4.9,1698,0,0,2,08.11.2017 10:20:33,37.57345,-84.281384,(GMT-05:00) America/New_York,0,0,1373058722,1373058722,-18000,2017-11-08,0.74,https://www.strava.com/activities/1266418758
1267862694,Run,,09.11.2017 07:03:25,7.1,Morning Run,38.3,6.552,5.84,10.27,12.24,4.071,9.4,6.38,7.61,46.3,7.07,,,82.7,,,0,0,everyone,,NA-US-KY-Berea,,,0.1,"[37.575154, -84.289641]","[37.575153, -84.290825]",291.1,299.5,1,0,0,{id},1,2.852,,0,6551.7,2335,garmin_push_2322947999,0,0,,0,0,0,,United Kingdom,,0,{id},3.4,2297,0,0,2,09.11.2017 12:03:25,37.575154,-84.289641,(GMT-05:00) America/New_York,0,0,1374499109,1374499109,-18000,2017-11-09,0.71,https://www.strava.com/activities/1267862694
1269047716,Run,,10.11.2017 05:12:46,5.2,A little birthday run on my day off,28.5,4.893,5.83,10.29,21.6,3.04,9.39,6.39,13.42,35.8,7.32,,,81.7,,,0,0,everyone,0,NA-US-KY-Berea,,,0.1,"[37.573399, -84.281376]","[37.57321, -84.28303]",292,314.1,0,0,0,{id},1,2.858,,0,4893.1,1777,garmin_push_2324369566,0,0,,0,0,0,,United Kingdom,,0,{id},6,1712,0,0,2,10.11.2017 10:12:46,37.573399,-84.281376,(GMT-05:00) America/New_York,0,0,1375682414,1375682414,-18000,2017-11-10,0.73,https://www.strava.com/activities/1269047716
1272199240,Run,,12.11.2017 07:58:37,8,Morning Run,79.3,12.965,6.12,9.8,12.6,8.056,9.85,6.09,7.83,100.9,7.78,,,83.1,,,0,0,everyone,,NA-US-KY-Berea,,,0,"[37.57335, -84.281464]","[37.573303, -84.281636]",277.1,314.1,0,0,0,{id},1,2.723,,0,12965.3,4879,garmin_push_2328230019,0,0,,0,0,0,,United Kingdom,,0,{id},3.5,4761,0,0,2,12.11.2017 12:58:37,37.57335,-84.281464,(GMT-05:00) America/New_York,0,0,1378906479,1378906479,-18000,2017-11-12,0.78,https://www.strava.com/activities/1272199240
1274827914,Run,,14.11.2017 07:03:12,7.1,Morning Run,38.2,6.917,5.52,10.87,16.2,4.298,8.88,6.76,10.07,32.9,4.76,,,82.9,,,0,0,everyone,,NA-US-KY-Berea,,,0,"[37.574318, -84.290316]","[37.5744, -84.289985]",286.5,306.8,1,0,1,{id},1,3.02,,0,6916.9,2371,garmin_push_2331392519,0,0,,0,0,0,,United Kingdom,,0,{id},4.5,2290,0,0,2,14.11.2017 12:03:12,37.574318,-84.290316,(GMT-05:00) America/New_York,0,0,1381500792,1381500792,-18000,2017-11-14,0.48,https://www.strava.com/activities/1274827914
1276110768,Run,,15.11.2017 05:14:01,5.2,Morning Run,29.9,4.953,6.04,9.93,23.04,3.077,9.73,6.17,14.32,36,7.27,,,82,,,0,0,everyone,,NA-US-KY-Berea,,,0.2,"[37.573853, -84.281015]","[37.573311, -84.283025]",292,314.1,2,0,0,{id},1,2.758,,0,4952.6,1880,garmin_push_2332910587,0,0,,0,0,0,,United Kingdom,,0,{id},6.4,1796,0,0,2,15.11.2017 10:14:01,37.573853,-84.281015,(GMT-05:00) America/New_York,0,0,1382786769,1382786769,-18000,2017-11-15,0.73,https://www.strava.com/activities/1276110768
1277626811,Run,,16.11.2017 07:00:18,7,Morning Run,21.9,3.805,5.76,10.42,12.96,2.364,9.27,6.48,8.05,25.8,6.78,,,82.2,,,0,0,everyone,,NA-US-KY-Berea,,,0.6,"[37.574248, -84.290254]","[37.57311, -84.283074]",292,311.2,1,0,1,{id},1,2.895,,0,3804.6,1323,garmin_push_2334708041,0,0,,0,0,0,,United Kingdom,,0,{id},3.6,1314,0,0,2,16.11.2017 12:00:18,37.574248,-84.290254,(GMT-05:00) America/New_York,0,0,1384306386,1384306386,-18000,2017-11-16,0.68,https://www.strava.com/activities/1277626811
1280667646,Run,,18.11.2017 06:25:40,6.4,Morning Run,58.8,9.686,6.07,9.88,13.68,6.018,9.77,6.14,8.5,117,12.08,,,82.5,,,0,0,everyone,,NA-US-KY-Berea,,,0.1,"[37.573372, -84.281498]","[37.57314, -84.283149]",292.4,311.2,1,0,0,{id},1,2.745,,0,9685.7,3623,garmin_push_2338424703,0,0,,0,0,0,,United Kingdom,,0,{id},3.8,3528,0,0,2,18.11.2017 11:25:40,37.573372,-84.281498,(GMT-05:00) America/New_York,0,0,1387357243,1387357243,-18000,2017-11-18,1.21,https://www.strava.com/activities/1280667646
1282050843,Run,,19.11.2017 07:35:46,7.6,Morning Run,77.7,13.12,5.92,10.13,20.16,8.152,9.53,6.3,12.53,99.7,7.6,,,83.8,,,0,0,everyone,,NA-US-KY-Berea,,,0.2,"[37.573476, -84.281262]","[37.573309, -84.28306]",277.4,314.1,1,0,0,{id},1,2.815,,0,13119.9,4746,garmin_push_2340062012,0,0,,0,0,0,,United Kingdom,,0,{id},5.6,4661,0,0,2,19.11.2017 12:35:46,37.573476,-84.281262,(GMT-05:00) America/New_York,0,0,1388762432,1388762432,-18000,2017-11-19,0.76,https://www.strava.com/activities/1282050843
1284464841,Run,,21.11.2017 07:02:08,7,Morning Run,39,6.906,5.64,10.64,15.84,4.291,9.08,6.61,9.84,33.4,4.84,,,82.2,,,0,0,everyone,,NA-US-KY-Berea,,,0,"[37.574385, -84.290163]","[37.574433, -84.289982]",286.6,304.7,1,0,0,{id},1,2.955,,0,6905.7,2337,garmin_push_2343092652,0,0,,0,0,0,,United Kingdom,,0,{id},4.4,2337,0,0,2,21.11.2017 12:02:08,37.574385,-84.290163,(GMT-05:00) America/New_York,0,0,1391183283,1391183283,-18000,2017-11-21,0.48,https://www.strava.com/activities/1284464841
1285835821,Run,,22.11.2017 07:22:04,7.4,Morning Run,40.9,6.866,5.96,10.07,16.56,4.266,9.59,6.25,10.29,50.1,7.3,,,82.6,,,0,0,everyone,,NA-US-KY-Berea,,,0.1,"[37.57337, -84.281424]","[37.573233, -84.283097]",291,317.8,0,0,0,{id},1,2.796,,0,6866.2,2541,garmin_push_2344758497,0,0,,0,0,0,,United Kingdom,,0,{id},4.6,2456,0,0,2,22.11.2017 12:22:04,37.57337,-84.281424,(GMT-05:00) America/New_York,0,0,1392559462,1392559462,-18000,2017-11-22,0.73,https://www.strava.com/activities/1285835821
1288534863,Run,,24.11.2017 08:09:41,8.2,Morning Run,49.1,8.104,6.06,9.91,12.24,5.036,9.75,6.16,7.61,42.6,5.26,,,81.9,,,0,0,everyone,,NA-US-KY-Berea,,,0.1,"[37.573367, -84.28141]","[37.573199, -84.283002]",292,311.2,2,0,0,{id},1,2.752,,0,8104.3,2980,garmin_push_2348023468,0,0,,0,0,0,,United Kingdom,,0,{id},3.4,2945,0,0,2,24.11.2017 13:09:41,37.573367,-84.28141,(GMT-05:00) America/New_York,0,0,1395274465,1395274465,-18000,2017-11-24,0.53,https://www.strava.com/activities/1288534863
1289865431,Run,,25.11.2017 08:05:26,8.1,Morning Run,28.3,4.856,5.83,10.29,17.64,3.018,9.39,6.39,10.96,36,7.41,,,81.5,,,0,0,everyone,,NA-US-KY-Berea,,,0.1,"[37.573457, -84.281453]","[37.573276, -84.283071]",292,314.1,0,0,0,{id},1,2.857,,0,4856.5,1788,garmin_push_2349611708,0,0,,0,0,0,,United Kingdom,,0,{id},4.9,1700,0,0,2,25.11.2017 13:05:26,37.573457,-84.281453,(GMT-05:00) America/New_York,0,0,1396615309,1396615309,-18000,2017-11-25,0.74,https://www.strava.com/activities/1289865431
1292283983,Run,,26.11.2017 10:31:07,10.5,Morning Run,76.8,12.266,6.26,9.59,16.2,7.622,10.07,5.96,10.07,89.4,7.29,,,82.6,,,0,0,everyone,,NA-US-KY-Berea,,,0.1,"[37.573248, -84.281352]","[37.573335, -84.283025]",276.9,311.8,1,0,0,{id},1,2.664,,0,12265.8,4814,garmin_push_2352613775,0,0,,0,0,0,,United Kingdom,,0,{id},4.5,4605,0,0,2,26.11.2017 15:31:07,37.573248,-84.281352,(GMT-05:00) America/New_York,0,0,1399064772,1399064772,-18000,2017-11-26,0.73,https://www.strava.com/activities/1292283983
1293785438,Run,,28.11.2017 05:14:15,5.2,Morning Run,30.5,4.915,6.21,9.66,14.4,3.054,10,6,8.95,36,7.32,,,81.2,,,0,0,everyone,,NA-US-KY-Berea,,,0.2,"[37.573144, -84.281235]","[37.573319, -84.283019]",292,314.1,1,0,0,{id},1,2.683,,0,4915.5,1920,garmin_push_2354559732,0,0,,0,0,0,,United Kingdom,,0,{id},4,1832,0,0,2,28.11.2017 10:14:15,37.573144,-84.281235,(GMT-05:00) America/New_York,0,0,1400572398,1400572398,-18000,2017-11-28,0.73,https://www.strava.com/activities/1293785438
1295170755,Run,,29.11.2017 05:14:03,5.2,Morning Run,39.1,6.486,6.03,9.96,12.96,4.03,9.7,6.19,8.05,76.2,11.75,,,81.3,,,0,0,everyone,,NA-US-KY-Berea,,,0.1,"[37.573364, -84.281539]","[37.573245, -84.282872]",293.1,311.2,1,0,0,{id},1,2.766,,0,6486,2378,garmin_push_2356261167,0,0,,0,0,0,,United Kingdom,,0,{id},3.6,2345,0,0,2,29.11.2017 10:14:03,37.573364,-84.281539,(GMT-05:00) America/New_York,0,0,1401979373,1401979373,-18000,2017-11-29,1.17,https://www.strava.com/activities/1295170755
1296441350,Run,,30.11.2017 05:13:44,5.2,Morning Run,30.1,4.877,6.18,9.71,16.2,3.031,9.95,6.03,10.07,35.6,7.3,,,81.1,,,0,0,everyone,,NA-US-KY-Berea,,,0.2,"[37.573402, -84.281278]","[37.573367, -84.283025]",292,314.1,0,0,0,{id},1,2.696,,0,4877.2,1929,garmin_push_2357841572,0,0,,0,0,0,,United Kingdom,,0,{id},4.5,1809,0,0,2,30.11.2017 10:13:44,37.573402,-84.281278,(GMT-05:00) America/New_York,0,0,1403282535,1403282535,-18000,2017-11-30,0.73,https://www.strava.com/activities/1296441350
1302841871,Run,,02.12.2017 08:33:31,8.6,Morning Run,43.5,7.435,5.84,10.27,12.24,4.62,9.4,6.38,7.61,37.3,5.02,,,82.8,,,0,0,everyone,,NA-US-KY-Berea,,,0.4,"[37.572813, -84.288033]","[37.573235, -84.283015]",292,311.2,1,0,0,{id},1,2.852,,0,7434.7,2640,garmin_push_2365927197,0,0,,0,0,0,,United Kingdom,,0,{id},3.4,2607,0,0,2,02.12.2017 13:33:31,37.572813,-84.288033,(GMT-05:00) America/New_York,0,0,1409872035,1409872035,-18000,2017-12-02,0.5,https://www.strava.com/activities/1302841871
1302842091,Run,,05.12.2017 05:12:39,5.2,Morning Run,39.8,6.471,6.15,9.76,15.48,4.021,9.89,6.07,9.62,74.2,11.47,,,81.2,,,0,0,everyone,,NA-US-KY-Berea,,,0.1,"[37.573403, -84.281479]","[37.573206, -84.282261]",293,311.2,1,0,0,{id},1,2.712,,0,6470.6,2451,garmin_push_2365927422,0,0,,0,0,0,,United Kingdom,,0,{id},4.3,2386,0,0,2,05.12.2017 10:12:39,37.573403,-84.281479,(GMT-05:00) America/New_York,0,0,1409872213,1409872213,-18000,2017-12-05,1.15,https://www.strava.com/activities/1302842091
1304163250,Run,,06.12.2017 05:14:57,5.2,Morning Run,28.6,4.84,5.92,10.14,17.28,3.008,9.52,6.3,10.74,36.9,7.62,,,82,,,0,0,everyone,,NA-US-KY-Berea,,,0.2,"[37.57381, -84.281486]","[37.573317, -84.283107]",292,314.1,3,0,0,{id},1,2.816,,0,4840.3,1843,garmin_push_2367553518,0,0,,0,0,0,,United Kingdom,,0,{id},4.8,1719,0,0,2,06.12.2017 10:14:57,37.57381,-84.281486,(GMT-05:00) America/New_York,0,0,1411223547,1411223547,-18000,2017-12-06,0.76,https://www.strava.com/activities/1304163250
1305441272,Run,,07.12.2017 05:13:40,5.2,Morning Run,41.1,6.606,6.22,9.64,12.6,4.104,10.01,5.99,7.83,75.5,11.43,,,82.4,,,0,0,everyone,,NA-US-KY-Berea,,,0.2,"[37.573671, -84.281245]","[37.573127, -84.283908]",293.1,311.2,1,0,0,{id},1,2.679,,0,6605.5,3343,garmin_push_2369102482,0,0,,0,0,0,,United Kingdom,,0,{id},3.5,2466,0,0,2,07.12.2017 10:13:40,37.573671,-84.281245,(GMT-05:00) America/New_York,0,0,1412526172,1412526172,-18000,2017-12-07,1.14,https://www.strava.com/activities/1305441272
1308025237,Run,,09.12.2017 08:50:38,8.8,Morning Run,71.8,11.95,6.01,9.98,15.48,7.425,9.67,6.2,9.62,75.2,6.29,,,83.3,,,0,0,everyone,,NA-US-KY-Berea,,,0.2,"[37.573457, -84.28116]","[37.573213, -84.283013]",281,314.1,3,0,0,{id},1,2.773,,0,11949.9,4403,garmin_push_2372326136,0,0,,0,0,0,,United Kingdom,,0,{id},4.3,4310,0,0,2,09.12.2017 13:50:38,37.573457,-84.28116,(GMT-05:00) America/New_York,0,0,1415168736,1415168736,-18000,2017-12-09,0.63,https://www.strava.com/activities/1308025237
1311271305,Run,,12.12.2017 05:17:04,5.3,Morning Run,30.5,4.951,6.17,9.73,21.24,3.076,9.92,6.05,13.2,44.2,8.93,,,81.6,,,0,0,everyone,,NA-US-KY-Berea,,,0.2,"[37.574331, -84.281012]","[37.573305, -84.283085]",292,314.1,1,0,0,{id},1,2.703,,0,4951,1832,garmin_push_2376517536,0,0,,0,0,0,,United Kingdom,,0,{id},5.9,1832,0,0,2,12.12.2017 10:17:04,37.574331,-84.281012,(GMT-05:00) America/New_York,0,0,1418513280,1418513280,-18000,2017-12-12,0.89,https://www.strava.com/activities/1311271305
1312456939,Run,,13.12.2017 05:16:11,5.3,Morning Run,37.3,6.491,5.75,10.44,13.32,4.033,9.25,6.48,8.28,78.2,12.05,,,82.4,,,0,0,everyone,,NA-US-KY-Berea,,,0.1,"[37.57363, -84.281347]","[37.573196, -84.282148]",293.9,311.2,1,0,0,{id},1,2.899,,0,6490.8,2417,garmin_push_2377998424,0,0,,0,0,0,,United Kingdom,,0,{id},3.7,2239,0,0,2,13.12.2017 10:16:11,37.57363,-84.281347,(GMT-05:00) America/New_York,0,0,1419735014,1419735014,-18000,2017-12-13,1.2,https://www.strava.com/activities/1312456939
1313554456,Run,,14.12.2017 05:16:07,5.3,Morning Run,29.8,4.878,6.12,9.81,19.44,3.031,9.84,6.1,12.08,36.2,7.42,,,82.2,,,0,0,everyone,,NA-US-KY-Berea,,,0.2,"[37.573309, -84.281358]","[37.573251, -84.283076]",292,314.1,2,0,0,{id},1,2.725,,0,4878.1,1846,garmin_push_2379394892,0,0,,0,0,0,,United Kingdom,,0,{id},5.4,1790,0,0,2,14.12.2017 10:16:07,37.573309,-84.281358,(GMT-05:00) America/New_York,0,0,1420850357,1420850357,-18000,2017-12-14,0.74,https://www.strava.com/activities/1313554456
1316596817,Run,,16.12.2017 14:03:00,14.1,Afternoon Run,53.1,8.293,6.4,9.37,12.24,5.153,10.3,5.82,7.61,96,11.58,,,81.5,,,0,0,everyone,,NA-US-GA-Atlanta,,,0,"[33.742774, -84.35291]","[33.742966, -84.352652]",283,319,1,0,0,{id},1,2.604,,0,8292.9,3491,garmin_push_2383206241,0,0,,0,0,0,,United Kingdom,,0,{id},3.4,3185,0,0,2,16.12.2017 19:03:00,33.742774,-84.35291,(GMT-05:00) America/New_York,0,0,1423955221,1423955221,-18000,2017-12-16,1.16,https://www.strava.com/activities/1316596817
1321450743,Run,,18.12.2017 10:14:27,10.2,Morning Run,40.7,5.96,6.83,8.78,12.24,3.703,11,5.46,7.61,73.2,12.28,,,77.7,,,0,0,everyone,,NA-US-GA-Atlanta,,,0,"[33.742867, -84.35302]","[33.742953, -84.353123]",277.9,315.7,2,0,0,{id},1,2.439,,0,5960,2558,garmin_push_2389306461,0,0,,0,0,0,,United Kingdom,,0,{id},3.4,2444,0,0,2,18.12.2017 15:14:27,33.742867,-84.35302,(GMT-05:00) America/New_York,0,0,1428949352,1428949352,-18000,2017-12-18,1.23,https://www.strava.com/activities/1321450743
1321450806,Run,,19.12.2017 09:00:03,9,Morning Run,30,4.887,6.14,9.77,19.44,3.037,9.88,6.07,12.08,36,7.37,,,80.5,,,0,0,everyone,,NA-US-KY-Berea,,,0.2,"[37.573395, -84.281176]","[37.57329, -84.283026]",292,314.1,1,0,0,{id},1,2.715,,0,4886.9,1851,garmin_push_2389306552,0,0,,0,0,0,,United Kingdom,,0,{id},5.4,1800,0,0,2,19.12.2017 14:00:03,37.573395,-84.281176,(GMT-05:00) America/New_York,0,0,1428949417,1428949417,-18000,2017-12-19,0.74,https://www.strava.com/activities/1321450806
1321450908,Run,,20.12.2017 08:31:00,8.5,Morning Run,41.7,6.912,6.03,9.95,14.76,4.295,9.7,6.19,9.17,32.8,4.75,,,83.1,,,0,0,everyone,,NA-US-KY-Berea,,,0,"[37.574344, -84.290304]","[37.574413, -84.289828]",286.3,304.5,2,0,0,{id},1,2.765,,0,6911.9,2511,garmin_push_2389306683,0,0,,0,0,0,,United Kingdom,,0,{id},4.1,2500,0,0,2,20.12.2017 13:31:00,37.574344,-84.290304,(GMT-05:00) America/New_York,0,0,1428949516,1428949516,-18000,2017-12-20,0.47,https://www.strava.com/activities/1321450908
1323070254,Run,,22.12.2017 07:44:43,7.7,Morning Run,48.1,8.093,5.95,10.09,12.96,5.029,9.57,6.27,8.05,43.5,5.38,,,81.6,,,0,0,everyone,,NA-US-KY-Berea,,,0.1,"[37.573403, -84.281364]","[37.573292, -84.283038]",292,311.2,1,0,0,{id},1,2.802,,0,8092.6,2973,garmin_push_2391370199,0,0,,0,0,0,,United Kingdom,,0,{id},3.6,2888,0,0,2,22.12.2017 12:44:43,37.573403,-84.281364,(GMT-05:00) America/New_York,0,0,1430611970,1430611970,-18000,2017-12-22,0.54,https://www.strava.com/activities/1323070254
1331295427,Run,,25.12.2017 09:44:11,9.7,Morning Run,29,4.841,5.98,10.03,14.76,3.008,9.63,6.23,9.17,35.8,7.4,,,82.9,,,0,0,everyone,,NA-US-KY-Berea,,,0.1,"[37.573321, -84.28145]","[37.573226, -84.283076]",292,314.1,0,0,0,{id},1,2.785,,0,4841.1,1847,garmin_push_2401977583,0,0,,0,0,0,,United Kingdom,,0,{id},4.1,1738,0,0,2,25.12.2017 14:44:11,37.573321,-84.28145,(GMT-05:00) America/New_York,0,0,1439162084,1439162084,-18000,2017-12-25,0.74,https://www.strava.com/activities/1331295427
1331295504,Run,,27.12.2017 14:56:39,14.9,Afternoon Run,47.2,6.786,6.96,8.62,10.8,4.217,11.2,5.36,6.71,50.2,7.4,,,80.8,,,0,0,everyone,,NA-US-WA-Fife,,,0.2,"[47.19484, -122.367797]","[47.195254, -122.365442]",92.2,138,1,0,0,{id},1,2.395,,0,6786.3,2924,garmin_push_2401977698,0,0,,0,0,0,,United Kingdom,,0,{id},3,2833,0,0,2,27.12.2017 22:56:39,47.19484,-122.367797,(GMT-08:00) America/Los_Angeles,0,0,1439162155,1439162155,-28800,2017-12-27,0.74,https://www.strava.com/activities/1331295504
1331295574,Run,,28.12.2017 06:43:25,6.7,Morning Run,26.5,4.178,6.35,9.45,14.4,2.596,10.21,5.87,8.95,42.1,10.08,,,81.8,,,0,0,everyone,,NA-US-WA-Fife,,,2.6,"[47.194719, -122.367801]","[47.177896, -122.343566]",104,131,0,0,0,{id},1,2.626,,0,4177.9,1591,garmin_push_2401977753,0,0,,0,0,0,,United Kingdom,,0,{id},4,1591,0,0,2,28.12.2017 14:43:25,47.194719,-122.367801,(GMT-08:00) America/Los_Angeles,0,0,1439162214,1439162214,-28800,2017-12-28,1.01,https://www.strava.com/activities/1331295574
1331295620,Run,,28.12.2017 07:14:44,7.2,Morning Run,28.9,3.996,7.24,8.29,10.44,2.483,11.65,5.15,6.49,29.1,7.28,,,82,,,0,0,everyone,,NA-US-WA-Puyallup,,,0.1,"[47.178006, -122.343071]","[47.177771, -122.344059]",112.1,126.2,0,0,0,{id},1,2.302,,0,3995.6,1736,garmin_push_2401977829,0,0,,0,0,0,,United Kingdom,,0,{id},2.9,1736,0,0,2,28.12.2017 15:14:44,47.178006,-122.343071,(GMT-08:00) America/Los_Angeles,0,0,1439162270,1439162270,-28800,2017-12-28,0.73,https://www.strava.com/activities/1331295620
1331295662,Run,,28.12.2017 07:51:10,7.9,Morning Run,25.8,4.118,6.27,9.57,12.24,2.559,10.09,5.95,7.61,45.8,11.12,,,83.1,,,0,0,everyone,,NA-US-WA-Puyallup,,,2.6,"[47.177907, -122.343184]","[47.194025, -122.367886]",104,131.1,0,0,1,{id},1,2.659,,0,4118.4,1549,garmin_push_2401977898,0,0,,0,0,0,,United Kingdom,,0,{id},3.4,1549,0,1,2,28.12.2017 15:51:10,47.177907,-122.343184,(GMT-08:00) America/Los_Angeles,0,0,1439162319,1439162319,-28800,2017-12-28,1.11,https://www.strava.com/activities/1331295662
1333960619,Run,,30.12.2017 06:43:05,6.7,Morning Run,26.1,4.234,6.16,9.75,26.64,2.631,9.91,6.06,16.55,42.4,10.01,,,81.7,,,0,0,everyone,,NA-US-WA-Fife,,,2.7,"[47.195568, -122.367819]","[47.177883, -122.344092]",104,133.2,0,0,0,{id},1,2.707,,0,4234.2,1576,garmin_push_2405481736,0,0,,0,0,0,,United Kingdom,,0,{id},7.4,1564,0,0,2,30.12.2017 14:43:05,47.195568,-122.367819,(GMT-08:00) America/Los_Angeles,0,0,1441934196,1441934196,-28800,2017-12-30,1,https://www.strava.com/activities/1333960619
1333960707,Run,,30.12.2017 07:13:30,7.2,Morning Run,68,9.037,7.52,7.98,10.44,5.616,12.1,4.96,6.49,113.5,12.56,,,81.1,,,0,0,everyone,,NA-US-WA-Puyallup,,,0.2,"[47.177207, -122.343966]","[47.177214, -122.341659]",104,138,1,0,0,{id},1,2.216,,0,9037.4,4081,garmin_push_2405481851,0,0,,0,0,0,,United Kingdom,,0,{id},2.9,4078,0,0,2,30.12.2017 15:13:30,47.177207,-122.343966,(GMT-08:00) America/Los_Angeles,0,0,1441934302,1441934302,-28800,2017-12-30,1.26,https://www.strava.com/activities/1333960707
1333960784,Run,,30.12.2017 08:28:26,8.5,Morning Run,27,4.113,6.56,9.14,10.8,2.555,10.56,5.68,6.71,45.5,11.06,,,82.8,,,0,0,everyone,,NA-US-WA-Puyallup,,,2.6,"[47.177916, -122.343213]","[47.19413, -122.367929]",104.1,131.1,1,0,1,{id},1,2.539,,0,4112.6,1620,garmin_push_2405481912,0,0,,0,0,0,,United Kingdom,,0,{id},3,1620,0,1,2,30.12.2017 16:28:26,47.177916,-122.343213,(GMT-08:00) America/Los_Angeles,0,0,1441934364,1441934364,-28800,2017-12-30,1.11,https://www.strava.com/activities/1333960784
1335096652,Run,,31.12.2017 10:00:56,10,Morning Run,43.6,7.254,6.01,9.98,15.84,4.507,9.67,6.2,9.84,73,10.06,,,83,,,0,0,everyone,,NA-US-WA-Fife,,,0.2,"[47.194898, -122.367645]","[47.192739, -122.367943]",75,131.1,1,0,1,{id},1,2.773,,0,7254,2616,garmin_push_2406919704,0,0,,0,0,0,,United Kingdom,,0,{id},4.4,2616,0,1,2,31.12.2017 18:00:56,47.194898,-122.367645,(GMT-08:00) America/Los_Angeles,0,0,1443116786,1443116786,-28800,2017-12-31,1.01,https://www.strava.com/activities/1335096652
1355354408,Run,,01.01.2018 08:48:08,8.8,Morning Run,51.1,6.808,7.5,8,11.52,4.23,12.08,4.97,7.16,54.8,8.05,,,80.6,,,0,0,everyone,,NA-US-WA-Fife,,,0.2,"[47.194923, -122.36775]","[47.192996, -122.367902]",114.4,133.2,0,0,0,{id},1,2.221,,0,6807.5,4002,garmin_push_2432510630,0,0,,0,0,0,,United Kingdom,,0,{id},3.2,3065,0,0,2,01.01.2018 16:48:08,47.194923,-122.36775,(GMT-08:00) America/Los_Angeles,0,0,1464155368,1464155368,-28800,2018-01-01,0.8,https://www.strava.com/activities/1355354408
1355350390,Run,,13.01.2018 10:55:02,10.9,Morning Run,52,8.08,6.44,9.31,11.16,5.021,10.37,5.79,6.93,42.2,5.22,,,82.1,,,0,0,everyone,,NA-US-KY-Berea,,,0.1,"[37.573323, -84.281385]","[37.573539, -84.283032]",292,311.2,2,0,0,{id},1,2.587,,0,8080,3209,garmin_push_2432511206,0,0,,0,0,0,,United Kingdom,,0,{id},3.1,3123,0,0,2,13.01.2018 15:55:02,37.573323,-84.281385,(GMT-05:00) America/New_York,0,0,1464155847,1464155847,-18000,2018-01-13,0.52,https://www.strava.com/activities/1355350390
1358714262,Run,,15.01.2018 09:37:37,9.6,"Post-illness, a few inches of snow and 13 weeks pregnant...So slow!",30.7,4.876,6.29,9.54,15.48,3.03,10.12,5.93,9.62,35.6,7.3,,,82.7,,,0,0,everyone,0,NA-US-KY-Berea,,,0.2,"[37.573406, -84.281372]","[37.573204, -84.283293]",292,314.1,1,0,0,{id},1,2.65,,0,4876.4,1911,garmin_push_2436802666,0,0,,0,0,0,,United Kingdom,,0,{id},4.3,1840,0,0,2,15.01.2018 14:37:37,37.573406,-84.281372,(GMT-05:00) America/New_York,0,0,1467647603,1467647603,-18000,2018-01-15,0.73,https://www.strava.com/activities/1358714262
1366469109,Run,,20.01.2018 09:01:49,9,"14 weeks preggo and so, so slow",52.2,8.162,6.4,9.37,17.28,5.072,10.3,5.82,10.74,44.1,5.4,,,81.6,,,0,0,everyone,0,NA-US-KY-Berea,,,0.1,"[37.573351, -84.281389]","[37.573278, -84.28304]",292,311.2,1,0,0,{id},1,2.604,,0,8162.5,3311,garmin_push_2446558632,0,0,,0,0,0,,United Kingdom,,0,{id},4.8,3134,0,0,2,20.01.2018 14:01:49,37.573351,-84.281389,(GMT-05:00) America/New_York,0,0,1475693186,1475693186,-18000,2018-01-20,0.54,https://www.strava.com/activities/1366469109
1369063822,Hike,,21.01.2018 13:18:07,13.3,Meeting Hike,120,7.966,15.06,3.99,7.2,4.95,24.23,2.48,4.47,346.1,43.45,,,53.9,,,0,0,everyone,,NA-US-KY-Berea,,,0,"[37.554404, -84.240841]","[37.554497, -84.240713]",310,472,1,0,0,{id},1,1.107,,0,7965.9,8224,garmin_push_2449850457,0,0,,0,0,0,,United Kingdom,,0,{id},2,7197,0,0,2,21.01.2018 18:18:07,37.554404,-84.240841,(GMT-05:00) America/New_York,4,0,1478420418,1478420418,-18000,2018-01-21,4.34,https://www.strava.com/activities/1369063822
1370200970,Run,,22.01.2018 13:58:21,14,Afternoon Run,37.7,5.652,6.67,8.99,17.64,3.512,10.74,5.59,10.96,48.1,8.51,,,80.9,,,0,0,everyone,,NA-US-KY-Berea,,,0.1,"[37.573103, -84.29048]","[37.572786, -84.289668]",279.1,311.8,0,0,1,{id},1,2.497,,0,5652.1,2475,garmin_push_2451382971,0,0,,0,0,0,,United Kingdom,,0,{id},4.9,2264,0,0,2,22.01.2018 18:58:21,37.573103,-84.29048,(GMT-05:00) America/New_York,0,0,1479600556,1479600556,-18000,2018-01-22,0.85,https://www.strava.com/activities/1370200970
1371020993,Run,,23.01.2018 05:12:04,5.2,Morning Run,52.1,8.082,6.44,9.31,12.24,5.022,10.37,5.79,7.61,83.3,10.31,,,82.1,,,0,0,everyone,,NA-US-KY-Berea,,,0,"[37.573376, -84.28138]","[37.573454, -84.281185]",291.2,314.1,2,0,0,{id},1,2.587,,0,8082,3208,garmin_push_2452383142,0,0,,0,0,0,,United Kingdom,,0,{id},3.4,3124,0,0,2,23.01.2018 10:12:04,37.573376,-84.28138,(GMT-05:00) America/New_York,0,0,1480450812,1480450812,-18000,2018-01-23,1.03,https://www.strava.com/activities/1371020993
1372704580,Run,,24.01.2018 05:16:23,5.3,Morning Run,36.4,5.639,6.46,9.29,12.6,3.504,10.39,5.77,7.83,46.3,8.21,,,81.9,,,0,0,everyone,,NA-US-KY-Berea,,,0.1,"[37.57335, -84.281388]","[37.573227, -84.282176]",292,314.1,2,0,0,{id},1,2.581,,0,5639.3,2239,garmin_push_2454458305,0,0,,0,0,0,,United Kingdom,,0,{id},3.5,2185,0,0,2,24.01.2018 10:16:23,37.57335,-84.281388,(GMT-05:00) America/New_York,0,0,1482173276,1482173276,-18000,2018-01-24,0.82,https://www.strava.com/activities/1372704580
1378773087,Run,,27.01.2018 08:09:26,8.2,Morning Run,63.7,9.664,6.59,9.1,11.88,6.005,10.61,5.66,7.38,63.9,6.61,,,82.8,,,0,0,everyone,,NA-US-KY-Berea,,,0,"[37.573381, -84.281401]","[37.573592, -84.281264]",286.2,311.2,2,0,0,{id},1,2.529,,0,9663.5,3843,garmin_push_2462137491,0,0,,0,0,0,,United Kingdom,,0,{id},3.3,3821,0,0,2,27.01.2018 13:09:26,37.573381,-84.281401,(GMT-05:00) America/New_York,0,0,1488382409,1488382409,-18000,2018-01-27,0.66,https://www.strava.com/activities/1378773087
1380354232,Ride,,28.01.2018 14:08:19,14.1,Riding with my girl,36.9,5.034,7.33,8.19,25.56,3.128,11.8,5.09,15.88,38.5,7.65,,,,,,0,0,everyone,10,NA-US-KY-Berea,,,0,"[37.57326, -84.281181]","[37.573144, -84.281366]",304.6,313.6,2,0,0,{id},1,2.274,0,0,5033.6,3323,20d19d820d66054cdc386d2e45dc8cd6,0,0,,0,0,0,,United Kingdom,,0,{id},7.1,2214,0,0,2,28.01.2018 19:08:19,37.57326,-84.281181,(GMT-05:00) America/New_York,2,0,1490083276,1490083276,-18000,2018-01-28,0.76,https://www.strava.com/activities/1380354232
1381090918,Run,,29.01.2018 05:23:11,5.4,Morning Run,35.7,5.637,6.33,9.48,15.48,3.503,10.19,5.89,9.62,44.3,7.86,,,82.4,,,0,0,everyone,,NA-US-KY-Berea,,,0.1,"[37.573435, -84.281401]","[37.573211, -84.282156]",292,314.1,1,0,0,{id},1,2.632,,0,5637,2210,garmin_push_2465056711,0,0,,0,0,0,,United Kingdom,,0,{id},4.3,2142,0,0,2,29.01.2018 10:23:11,37.573435,-84.281401,(GMT-05:00) America/New_York,0,0,1490817786,1490817786,-18000,2018-01-29,0.79,https://www.strava.com/activities/1381090918
1382619769,Run,,30.01.2018 05:12:44,5.2,Morning Run,51.5,8.067,6.39,9.39,14.04,5.013,10.28,5.84,8.72,73.1,9.06,,,82.3,,,0,0,everyone,,NA-US-KY-Berea,,,0,"[37.573454, -84.281319]","[37.57327, -84.281836]",289.8,314.1,0,0,0,{id},1,2.609,,0,8066.9,3247,garmin_push_2467072713,0,0,,0,0,0,,United Kingdom,,0,{id},3.9,3092,0,0,2,30.01.2018 10:12:44,37.573454,-84.281319,(GMT-05:00) America/New_York,0,0,1492397211,1492397211,-18000,2018-01-30,0.91,https://www.strava.com/activities/1382619769
1384393673,Run,,31.01.2018 05:24:52,5.4,Morning Run,36.5,5.689,6.42,9.35,27.36,3.535,10.32,5.81,17,46,8.09,,,82.5,,,0,0,everyone,,NA-US-KY-Berea,,,0.1,"[37.573406, -84.281352]","[37.573222, -84.28209]",292,314.1,1,0,0,{id},1,2.598,,0,5688.7,2256,garmin_push_2469211219,0,0,,0,0,0,,United Kingdom,,0,{id},7.6,2190,0,0,2,31.01.2018 10:24:52,37.573406,-84.281352,(GMT-05:00) America/New_York,0,0,1494230936,1494230936,-18000,2018-01-31,0.81,https://www.strava.com/activities/1384393673
1389435263,Run,,03.02.2018 08:11:39,8.2,Morning Run,72.8,11.506,6.33,9.49,12.24,7.149,10.18,5.89,7.61,90,7.82,,,82.8,,,0,0,everyone,,NA-US-KY-Berea,,,0.2,"[37.573271, -84.281492]","[37.573206, -84.283259]",277.2,311,1,0,0,{id},1,2.635,,0,11505.9,4571,garmin_push_2475428048,0,0,,0,0,0,,United Kingdom,,0,{id},3.4,4367,0,0,2,03.02.2018 13:11:39,37.573271,-84.281492,(GMT-05:00) America/New_York,0,0,1499439943,1499439943,-18000,2018-02-03,0.78,https://www.strava.com/activities/1389435263
